bridge-11-5-4, 311, 9, 625, 324518553658426726783156020576256, 0.95, , 0.92274469442792
### CEG-AR ###
robust policy found
--------------------
Synthesis summary:
constraint 1: P>=19/20 [F ((x = 11) & (y = 5))]

method: None, synthesis time: 1.12 s
number of holes: 4, family size: 625, quotient: 311 states / 633 actions
explored: 83 %
MDP stats: avg MDP size: 0, iterations: 1098

feasible: yes
--------------------
True, 1.12, 1098, 83
### CEG-1by1 ###
> progress 83.035%, elapsed 3 s, estimated 3 s, iters = {DTMC: 1287}
robust policy found
--------------------
Synthesis summary:
constraint 1: P>=19/20 [F ((x = 11) & (y = 5))]

method: None, synthesis time: 3.25 s
number of holes: 4, family size: 625, quotient: 311 states / 633 actions
explored: 83 %
DTMC stats: avg DTMC size: 124, iterations: 1941

feasible: yes
--------------------
True, 3.25, 1941, 83
### AR-1by1 ###
robust policy found
--------------------
Synthesis summary:
constraint 1: P>=19/20 [F ((x = 11) & (y = 5))]

method: None, synthesis time: 0.37 s
number of holes: 4, family size: 625, quotient: 311 states / 633 actions
explored: 0 %
MDP stats: avg MDP size: 226, iterations: 1461

feasible: yes
--------------------
True, 0.37, 1461, 0
### POSMG ###
created 625 POMDPs
constructed union POSMG with 174376 states and 276250 actions
> progress 0.0%, elapsed 4 s, estimated 4873332 s (56 days), iters = {game: 2}
> progress 0.0%, elapsed 9 s, estimated 9585853 s (110 days), iters = {game: 3}
> progress 0.0%, elapsed 14 s, estimated 14331545 s (165 days), iters = {game: 4}
> progress 0.0%, elapsed 19 s, estimated 19099307 s (221 days), iters = {game: 5}
> progress 0.0%, elapsed 23 s, estimated 23551728 s (272 days), iters = {game: 6}
> progress 0.0%, elapsed 27 s, estimated 27958389 s (323 days), iters = {game: 7}
> progress 0.0%, elapsed 32 s, estimated 32487211 s (1 year), iters = {game: 8}
> progress 0.0%, elapsed 36 s, estimated 36939837 s (1 year), iters = {game: 9}
> progress 0.0%, elapsed 41 s, estimated 41436686 s (1 year), iters = {game: 10}
> progress 0.0%, elapsed 45 s, estimated 45878667 s (1 year), iters = {game: 11}
> progress 0.0%, elapsed 50 s, estimated 50334572 s (1 year), iters = {game: 12}
> progress 0.0%, elapsed 54 s, estimated 54848284 s (1 year), iters = {game: 13}
> progress 0.0%, elapsed 59 s, estimated 59444233 s (1 year), iters = {game: 14}
> progress 0.0%, elapsed 64 s, estimated 64131553 s (2 years), iters = {game: 15}
> progress 0.0%, elapsed 68 s, estimated 68689460 s (2 years), iters = {game: 16}
> progress 0.0%, elapsed 73 s, estimated 73237257 s (2 years), iters = {game: 17}
> progress 0.0%, elapsed 77 s, estimated 77716439 s (2 years), iters = {game: 18}
> progress 0.0%, elapsed 83 s, estimated 83127102 s (2 years), iters = {game: 20}
> progress 0.0%, elapsed 88 s, estimated 88063266 s (2 years), iters = {game: 22}
> progress 0.0%, elapsed 91 s, estimated 91994449 s (2 years), iters = {game: 24}
> progress 0.0%, elapsed 95 s, estimated 95391586 s (3 years), iters = {game: 26}
> progress 0.0%, elapsed 99 s, estimated 99002657 s (3 years), iters = {game: 29}
> progress 0.0%, elapsed 102 s, estimated 59200103479992909824 s (1877222966767 years), iters = {game: 33}, opt = 0.9227
> progress 0.0%, elapsed 105 s, estimated 3810841942778544128 s (120841005288 years), iters = {game: 37}, opt = 0.9227
> progress 0.0%, elapsed 108 s, estimated 490631248170979328 s (15557814820 years), iters = {game: 40}, opt = 0.9227
> progress 0.0%, elapsed 112 s, estimated 63497740195648000 s (2013500133 years), iters = {game: 43}, opt = 0.9227
> progress 0.0%, elapsed 116 s, estimated 16339234804477312 s (518113736 years), iters = {game: 45}, opt = 0.9227
> progress 0.0%, elapsed 119 s, estimated 4205910582462112 s (133368549 years), iters = {game: 47}, opt = 0.9227
> progress 0.0%, elapsed 123 s, estimated 1084050217966144 s (34375006 years), iters = {game: 49}, opt = 0.9227
> progress 0.0%, elapsed 127 s, estimated 186916586534562 s (5927086 years), iters = {game: 52}, opt = 0.9227
> progress 0.0%, elapsed 131 s, estimated 144985941606861 s (4597474 years), iters = {game: 54}, opt = 0.9227
> progress 0.0%, elapsed 135 s, estimated 140428183834872 s (4452948 years), iters = {game: 56}, opt = 0.9227
> progress 0.0%, elapsed 139 s, estimated 144309094369107 s (4576011 years), iters = {game: 58}, opt = 0.9227
> progress 0.0%, elapsed 142 s, estimated 147664494281172 s (4682410 years), iters = {game: 60}, opt = 0.9227
> progress 0.0%, elapsed 146 s, estimated 151447186254043 s (4802358 years), iters = {game: 63}, opt = 0.9227
> progress 0.0%, elapsed 149 s, estimated 154725885735768 s (4906325 years), iters = {game: 67}, opt = 0.9321
> progress 0.0%, elapsed 152 s, estimated 158276982207735 s (5018930 years), iters = {game: 72}, opt = 0.9321
> progress 0.0%, elapsed 156 s, estimated 162325005130889 s (5147292 years), iters = {game: 76}, opt = 0.9321
> progress 0.0%, elapsed 160 s, estimated 165972453936572 s (5262951 years), iters = {game: 79}, opt = 0.9321
> progress 0.0%, elapsed 164 s, estimated 170363083137114 s (5402177 years), iters = {game: 82}, opt = 0.9321
> progress 0.0%, elapsed 168 s, estimated 172837783824416 s (5480650 years), iters = {game: 84}, opt = 0.9321
> progress 0.0%, elapsed 171 s, estimated 172683968193532 s (5475772 years), iters = {game: 86}, opt = 0.9321
> progress 0.0%, elapsed 175 s, estimated 128816536611978 s (4084745 years), iters = {game: 89}, opt = 0.9321
> progress 0.0%, elapsed 180 s, estimated 99000260945973 s (3139277 years), iters = {game: 91}, opt = 0.9321
> progress 0.0%, elapsed 185 s, estimated 50863489431904 s (1612870 years), iters = {game: 93}, opt = 0.9321
> progress 0.0%, elapsed 190 s, estimated 6535646673202 s (207243 years), iters = {game: 96}, opt = 0.9321
> progress 0.0%, elapsed 194 s, estimated 1672088840637 s (53021 years), iters = {game: 98}, opt = 0.9321
> progress 0.0%, elapsed 199 s, estimated 1140089489325 s (36152 years), iters = {game: 99}, opt = 0.9321
> progress 0.0%, elapsed 206 s, estimated 885885525599 s (28091 years), iters = {game: 101}, opt = 0.9321
> progress 0.0%, elapsed 210 s, estimated 904939495276 s (28695 years), iters = {game: 102}, opt = 0.9321
> progress 0.0%, elapsed 215 s, estimated 924475764199 s (29314 years), iters = {game: 103}, opt = 0.9321
> progress 0.0%, elapsed 219 s, estimated 941811919521 s (29864 years), iters = {game: 104}, opt = 0.9321
> progress 0.0%, elapsed 222 s, estimated 957650408261 s (30366 years), iters = {game: 105}, opt = 0.9321
> progress 0.0%, elapsed 226 s, estimated 971825454689 s (30816 years), iters = {game: 106}, opt = 0.9321
> progress 0.0%, elapsed 230 s, estimated 986180723118 s (31271 years), iters = {game: 107}, opt = 0.9321
> progress 0.0%, elapsed 234 s, estimated 1001122522272 s (31745 years), iters = {game: 109}, opt = 0.9321
> progress 0.0%, elapsed 237 s, estimated 1015579921204 s (32203 years), iters = {game: 110}, opt = 0.9321
> progress 0.0%, elapsed 241 s, estimated 1029813553047 s (32655 years), iters = {game: 111}, opt = 0.9321
> progress 0.0%, elapsed 245 s, estimated 1044246086526 s (33112 years), iters = {game: 113}, opt = 0.9321
> progress 0.0%, elapsed 248 s, estimated 1058677153510 s (33570 years), iters = {game: 114}, opt = 0.9321
> progress 0.0%, elapsed 252 s, estimated 1072542185011 s (34010 years), iters = {game: 115}, opt = 0.9321
> progress 0.0%, elapsed 256 s, estimated 1087502981399 s (34484 years), iters = {game: 117}, opt = 0.9321
> progress 0.0%, elapsed 260 s, estimated 1102725193490 s (34967 years), iters = {game: 118}, opt = 0.9321
> progress 0.0%, elapsed 263 s, estimated 1117638114259 s (35440 years), iters = {game: 119}, opt = 0.9321
> progress 0.0%, elapsed 267 s, estimated 1132360621567 s (35906 years), iters = {game: 121}, opt = 0.9321
> progress 0.0%, elapsed 271 s, estimated 1147658569875 s (36392 years), iters = {game: 122}, opt = 0.9321
> progress 0.0%, elapsed 275 s, estimated 1162009444792 s (36847 years), iters = {game: 123}, opt = 0.9321
> progress 0.0%, elapsed 278 s, estimated 1176035612102 s (37291 years), iters = {game: 124}, opt = 0.9321
> progress 0.0%, elapsed 282 s, estimated 1190167407197 s (37739 years), iters = {game: 126}, opt = 0.9321
> progress 0.0%, elapsed 286 s, estimated 1204723080393 s (38201 years), iters = {game: 127}, opt = 0.9321
> progress 0.0%, elapsed 289 s, estimated 1219136734214 s (38658 years), iters = {game: 128}, opt = 0.9321
> progress 0.0%, elapsed 293 s, estimated 1233558672001 s (39115 years), iters = {game: 130}, opt = 0.9321
> progress 0.0%, elapsed 297 s, estimated 1248002112853 s (39573 years), iters = {game: 131}, opt = 0.9321
--------------------
Synthesis summary:
optimality objective: Pmax=? [F "goal"] 

method: AR, synthesis time: 301.23 s
number of holes: 55, family size: 1e35, quotient: 174376 states / 276250 actions
explored: 0 %
Game stats: avg game size: 112421, iterations: 131

optimum: 0.932065
--------------------
A(P0,O0,M0)=up, A(P0,O14,M0)=up, A(P0,O15,M0)=up, A(P0,O30,M0)=up, A(P0,O31,M0)=up, A(P0,O32,M0)=up, A(P0,O52,M0)=up, A(P0,O53,M0)=up, A(P0,O54,M0)=down, A(P0,O55,M0)=right, A(P0,O80,M0)=down, A(P0,O81,M0)=up, A(P0,O82,M0)=up, A(P0,O83,M0)=right, A(P0,O84,M0)=right, A(P0,O108,M0)=up, A(P0,O109,M0)=right, A(P0,O111,M0)=up, A(P0,O112,M0)=up, A(P0,O113,M0)=right, A(P0,O137,M0)=up, A(P0,O138,M0)=up, A(P0,O139,M0)=right, A(P0,O141,M0)=up, A(P0,O142,M0)=right, A(P0,O165,M0)=down, A(P0,O166,M0)=up, A(P0,O168,M0)=up, A(P0,O169,M0)=right, A(P0,O171,M0)=right, A(P0,O194,M0)=down, A(P0,O195,M0)=down, A(P0,O196,M0)=up, A(P0,O198,M0)=up, A(P0,O199,M0)=right, A(P0,O224,M0)=down, A(P0,O225,M0)=down, A(P0,O226,M0)=down, A(P0,O227,M0)=up, A(P0,O229,M0)=right, A(P0,O253,M0)=down, A(P0,O254,M0)=down, A(P0,O255,M0)=down, A(P0,O256,M0)=up, A(P0,O257,M0)=right, A(P0,O278,M0)=down, A(P0,O279,M0)=down, A(P0,O280,M0)=up, A(P0,O281,M0)=right, A(P0,O296,M0)=down, A(P0,O297,M0)=up, A(P0,O298,M0)=right, A(P0,O308,M0)=down, A(P0,O309,M0)=right, A(P1,S0,M0)=model_499
--------------------
Synthesis summary:
constraint 1: P>=19/20 [F ((x = 11) & (y = 5))]

method: None, synthesis time: 1762.15 s
number of holes: 4, family size: 625, quotient: 311 states / 633 actions
explored: 0 %

feasible: no
--------------------
None, 1762.15, 0, 0
