mastermind-2-3-4, 17, 9, 8, 549755813888, 1.0, , 0.0
### CEG-AR ###
robust policy found
--------------------
Synthesis summary:
constraint 1: P>=1 [F "goal"]

method: None, synthesis time: 0.32 s
number of holes: 3, family size: 8, quotient: 17 states / 668 actions
explored: 0 %
MDP stats: avg MDP size: 0, iterations: 633

feasible: yes
--------------------
True, 0.32, 633, 0
### CEG-1by1 ###
robust policy found
--------------------
Synthesis summary:
constraint 1: P>=1 [F "goal"]

method: None, synthesis time: 0.78 s
number of holes: 3, family size: 8, quotient: 17 states / 668 actions
explored: 1 %
DTMC stats: avg DTMC size: 4, iterations: 1538

feasible: yes
--------------------
True, 0.78, 1538, 1
### AR-1by1 ###
robust policy found
--------------------
Synthesis summary:
constraint 1: P>=1 [F "goal"]

method: None, synthesis time: 0.01 s
number of holes: 3, family size: 8, quotient: 17 states / 668 actions
explored: 0 %
MDP stats: avg MDP size: 6, iterations: 254

feasible: yes
--------------------
True, 0.01, 254, 0
### POSMG ###
created 8 POMDPs
constructed union POSMG with 137 states and 872 actions
> progress 0.028%, elapsed 3 s, estimated 10504 s (2 hours), iters = {game: 14980}, opt = 0.0
> progress 0.046%, elapsed 6 s, estimated 12905 s (3 hours), iters = {game: 29478}, opt = 0.0
> progress 0.061%, elapsed 9 s, estimated 14654 s (4 hours), iters = {game: 45305}, opt = 0.0
> progress 0.075%, elapsed 12 s, estimated 15981 s (4 hours), iters = {game: 60114}, opt = 0.0
> progress 0.092%, elapsed 15 s, estimated 16183 s (4 hours), iters = {game: 74554}, opt = 0.0
> progress 0.113%, elapsed 18 s, estimated 15815 s (4 hours), iters = {game: 89075}, opt = 0.0
> progress 0.135%, elapsed 21 s, estimated 15535 s (4 hours), iters = {game: 103713}, opt = 0.0
> progress 0.155%, elapsed 24 s, estimated 15396 s (4 hours), iters = {game: 118730}, opt = 0.0
> progress 0.178%, elapsed 27 s, estimated 15128 s (4 hours), iters = {game: 133381}, opt = 0.0
> progress 0.198%, elapsed 30 s, estimated 15105 s (4 hours), iters = {game: 148175}, opt = 0.0
> progress 0.217%, elapsed 33 s, estimated 15154 s (4 hours), iters = {game: 163502}, opt = 0.0
> progress 0.236%, elapsed 36 s, estimated 15202 s (4 hours), iters = {game: 178560}, opt = 0.0
> progress 0.254%, elapsed 39 s, estimated 15354 s (4 hours), iters = {game: 194030}, opt = 0.0
> progress 0.267%, elapsed 42 s, estimated 15702 s (4 hours), iters = {game: 209360}, opt = 0.0
> progress 0.279%, elapsed 45 s, estimated 16079 s (4 hours), iters = {game: 223994}, opt = 0.0
> progress 0.296%, elapsed 48 s, estimated 16209 s (4 hours), iters = {game: 238106}, opt = 0.0
> progress 0.319%, elapsed 51 s, estimated 15982 s (4 hours), iters = {game: 252291}, opt = 0.0
> progress 0.335%, elapsed 54 s, estimated 16080 s (4 hours), iters = {game: 267052}, opt = 0.0
> progress 0.355%, elapsed 57 s, estimated 16039 s (4 hours), iters = {game: 282216}, opt = 0.0
> progress 0.375%, elapsed 60 s, estimated 15969 s (4 hours), iters = {game: 296855}, opt = 0.0
> progress 0.397%, elapsed 63 s, estimated 15863 s (4 hours), iters = {game: 311615}, opt = 0.0
> progress 0.421%, elapsed 66 s, estimated 15647 s (4 hours), iters = {game: 327364}, opt = 0.0
> progress 0.438%, elapsed 69 s, estimated 15742 s (4 hours), iters = {game: 343220}, opt = 0.0
> progress 0.462%, elapsed 72 s, estimated 15583 s (4 hours), iters = {game: 357376}, opt = 0.0
> progress 0.479%, elapsed 75 s, estimated 15656 s (4 hours), iters = {game: 371594}, opt = 0.0
> progress 0.506%, elapsed 78 s, estimated 15386 s (4 hours), iters = {game: 385136}, opt = 0.0
> progress 0.52%, elapsed 81 s, estimated 15576 s (4 hours), iters = {game: 399406}, opt = 0.0
> progress 0.534%, elapsed 84 s, estimated 15709 s (4 hours), iters = {game: 415173}, opt = 0.0
> progress 0.565%, elapsed 87 s, estimated 15372 s (4 hours), iters = {game: 429664}, opt = 0.0
> progress 0.591%, elapsed 90 s, estimated 15220 s (4 hours), iters = {game: 444763}, opt = 0.0
> progress 0.612%, elapsed 93 s, estimated 15184 s (4 hours), iters = {game: 460276}, opt = 0.0
> progress 0.625%, elapsed 96 s, estimated 15343 s (4 hours), iters = {game: 475314}, opt = 0.0
> progress 0.638%, elapsed 99 s, estimated 15515 s (4 hours), iters = {game: 489794}, opt = 0.0
> progress 0.654%, elapsed 102 s, estimated 15580 s (4 hours), iters = {game: 505079}, opt = 0.0
> progress 0.668%, elapsed 105 s, estimated 15705 s (4 hours), iters = {game: 519332}, opt = 0.0
> progress 0.687%, elapsed 108 s, estimated 15706 s (4 hours), iters = {game: 533555}, opt = 0.0
> progress 0.708%, elapsed 111 s, estimated 15664 s (4 hours), iters = {game: 548321}, opt = 0.0
> progress 0.723%, elapsed 114 s, estimated 15759 s (4 hours), iters = {game: 562812}, opt = 0.0
> progress 0.745%, elapsed 117 s, estimated 15700 s (4 hours), iters = {game: 577238}, opt = 0.0
> progress 0.773%, elapsed 120 s, estimated 15511 s (4 hours), iters = {game: 591558}, opt = 0.0
> progress 0.806%, elapsed 123 s, estimated 15247 s (4 hours), iters = {game: 605728}, opt = 0.0
> progress 0.827%, elapsed 126 s, estimated 15220 s (4 hours), iters = {game: 620483}, opt = 0.0
> progress 0.849%, elapsed 129 s, estimated 15178 s (4 hours), iters = {game: 635638}, opt = 0.0
> progress 0.867%, elapsed 132 s, estimated 15219 s (4 hours), iters = {game: 650422}, opt = 0.0
> progress 0.89%, elapsed 135 s, estimated 15154 s (4 hours), iters = {game: 663454}, opt = 0.0
> progress 0.913%, elapsed 138 s, estimated 15114 s (4 hours), iters = {game: 677120}, opt = 0.0
> progress 0.937%, elapsed 141 s, estimated 15045 s (4 hours), iters = {game: 691552}, opt = 0.0
> progress 0.969%, elapsed 144 s, estimated 14856 s (4 hours), iters = {game: 705035}, opt = 0.0
> progress 0.992%, elapsed 147 s, estimated 14820 s (4 hours), iters = {game: 720346}, opt = 0.0
> progress 1.011%, elapsed 150 s, estimated 14837 s (4 hours), iters = {game: 735694}, opt = 0.0
> progress 1.028%, elapsed 153 s, estimated 14878 s (4 hours), iters = {game: 750594}, opt = 0.0
> progress 1.041%, elapsed 156 s, estimated 14976 s (4 hours), iters = {game: 765923}, opt = 0.0
> progress 1.056%, elapsed 159 s, estimated 15049 s (4 hours), iters = {game: 780560}, opt = 0.0
> progress 1.077%, elapsed 162 s, estimated 15037 s (4 hours), iters = {game: 794992}, opt = 0.0
> progress 1.105%, elapsed 165 s, estimated 14924 s (4 hours), iters = {game: 808918}, opt = 0.0
> progress 1.135%, elapsed 168 s, estimated 14798 s (4 hours), iters = {game: 822933}, opt = 0.0
> progress 1.173%, elapsed 171 s, estimated 14567 s (4 hours), iters = {game: 837501}, opt = 0.0
> progress 1.201%, elapsed 174 s, estimated 14482 s (4 hours), iters = {game: 852007}, opt = 0.0
> progress 1.218%, elapsed 177 s, estimated 14530 s (4 hours), iters = {game: 866498}, opt = 0.0
> progress 1.237%, elapsed 180 s, estimated 14547 s (4 hours), iters = {game: 880841}, opt = 0.0
> progress 1.255%, elapsed 183 s, estimated 14579 s (4 hours), iters = {game: 895433}, opt = 0.0
> progress 1.282%, elapsed 186 s, estimated 14501 s (4 hours), iters = {game: 910154}, opt = 0.0
> progress 1.302%, elapsed 189 s, estimated 14511 s (4 hours), iters = {game: 925283}, opt = 0.0
> progress 1.326%, elapsed 192 s, estimated 14470 s (4 hours), iters = {game: 940054}, opt = 0.0
> progress 1.356%, elapsed 195 s, estimated 14374 s (3 hours), iters = {game: 952945}, opt = 0.0
> progress 1.378%, elapsed 198 s, estimated 14360 s (3 hours), iters = {game: 966765}, opt = 0.0
> progress 1.398%, elapsed 201 s, estimated 14376 s (3 hours), iters = {game: 981392}, opt = 0.0
> progress 1.419%, elapsed 204 s, estimated 14373 s (3 hours), iters = {game: 996186}, opt = 0.0
> progress 1.441%, elapsed 207 s, estimated 14361 s (3 hours), iters = {game: 1011113}, opt = 0.0
> progress 1.459%, elapsed 210 s, estimated 14386 s (3 hours), iters = {game: 1025657}, opt = 0.0
> progress 1.49%, elapsed 213 s, estimated 14296 s (3 hours), iters = {game: 1039553}, opt = 0.0
> progress 1.507%, elapsed 216 s, estimated 14331 s (3 hours), iters = {game: 1054060}, opt = 0.0
> progress 1.536%, elapsed 219 s, estimated 14253 s (3 hours), iters = {game: 1068223}, opt = 0.0
--------------------
Synthesis summary:
optimality objective: Pmax=? [F "goal"] 

method: AR, synthesis time: 221.18 s
number of holes: 14, family size: 1e12, quotient: 137 states / 872 actions
explored: 100 %
Game stats: avg game size: 61, iterations: 1077962

optimum: 1.0
--------------------
A(P0,O0,M0)=g010, A(P0,O2,M0)=g001, A(P0,O3,M0)=g001, A(P0,O4,M0)=g011, A(P0,O6,M0)=g001, A(P0,O7,M0)=g000, A(P0,O8,M0)=g101, A(P0,O10,M0)=g111, A(P0,O11,M0)=g110, A(P0,O12,M0)=g100, A(P0,O14,M0)=g000, A(P0,O15,M0)=g000, A(P0,O16,M0)=g000, A(P1,S0,M0)=model_0
--------------------
Synthesis summary:
constraint 1: P>=1 [F "goal"]

method: None, synthesis time: 221.19 s
number of holes: 3, family size: 8, quotient: 17 states / 668 actions
explored: 0 %

feasible: no
--------------------
None, 221.19, 0, 0
