rocks-4-2, 162, 7, 81, 79228162514264337593543950336, 1.0, , 0.0
### CEG-AR ###
robust policy found
--------------------
Synthesis summary:
constraint 1: P>=1 [F (visit1 & visit2)]

method: None, synthesis time: 19.48 s
number of holes: 4, family size: 81, quotient: 162 states / 594 actions
explored: 86 %
MDP stats: avg MDP size: 0, iterations: 19930

feasible: yes
--------------------
True, 19.48, 19930, 86
### CEG-1by1 ###
robust policy found
--------------------
Synthesis summary:
constraint 1: P>=1 [F (visit1 & visit2)]

method: None, synthesis time: 2.74 s
number of holes: 4, family size: 81, quotient: 162 states / 594 actions
explored: 41 %
DTMC stats: avg DTMC size: 49, iterations: 1214

feasible: yes
--------------------
True, 2.74, 1214, 41
### AR-1by1 ###
robust policy found
--------------------
Synthesis summary:
constraint 1: P>=1 [F (visit1 & visit2)]

method: None, synthesis time: 0.11 s
number of holes: 4, family size: 81, quotient: 162 states / 594 actions
explored: 0 %
MDP stats: avg MDP size: 80, iterations: 810

feasible: yes
--------------------
True, 0.11, 810, 0
### POSMG ###
created 81 POMDPs
constructed union POSMG with 10976 states and 21421 actions
> progress 0.0%, elapsed 3 s, estimated 3199730 s (37 days), iters = {game: 31}
> progress 0.0%, elapsed 7 s, estimated 7167586 s (82 days), iters = {game: 35}
> progress 0.0%, elapsed 10 s, estimated 10255086 s (118 days), iters = {game: 39}
> progress 0.0%, elapsed 13 s, estimated 5360018749692993714782208 s (169965079581842752 years), iters = {game: 44}, opt = 0.0
> progress 0.0%, elapsed 16 s, estimated 421879350717533797744640 s (13377706453498662 years), iters = {game: 49}, opt = 0.0
> progress 0.0%, elapsed 26 s, estimated 7696864260573850763264 s (244065964630068 years), iters = {game: 56}, opt = 0.0
> progress 0.0%, elapsed 29 s, estimated 275070597955284107264 s (8722431442011 years), iters = {game: 61}, opt = 0.0
> progress 0.0%, elapsed 32 s, estimated 37845023557448368128 s (1200057824627 years), iters = {game: 64}, opt = 0.0
> progress 0.0%, elapsed 36 s, estimated 650351861891694592 s (20622522256 years), iters = {game: 71}, opt = 0.0
> progress 0.0%, elapsed 39 s, estimated 172218601144872 s (5461016 years), iters = {game: 86}, opt = 0.0
> progress 0.0%, elapsed 42 s, estimated 355836919 s (11 years), iters = {game: 119}, opt = 0.0
> progress 0.0%, elapsed 45 s, estimated 383683268 s (12 years), iters = {game: 127}, opt = 0.0
> progress 0.0%, elapsed 49 s, estimated 417423478 s (13 years), iters = {game: 130}, opt = 0.0
> progress 0.0%, elapsed 53 s, estimated 450967259 s (14 years), iters = {game: 132}, opt = 0.0
> progress 0.0%, elapsed 57 s, estimated 484057984 s (15 years), iters = {game: 134}, opt = 0.0
> progress 0.0%, elapsed 61 s, estimated 516530193 s (16 years), iters = {game: 135}, opt = 0.0
> progress 0.0%, elapsed 65 s, estimated 547708844 s (17 years), iters = {game: 136}, opt = 0.0
> progress 0.0%, elapsed 69 s, estimated 582223623 s (18 years), iters = {game: 137}, opt = 0.0
> progress 0.0%, elapsed 73 s, estimated 616048884 s (19 years), iters = {game: 138}, opt = 0.0
> progress 0.0%, elapsed 77 s, estimated 647324225 s (20 years), iters = {game: 139}, opt = 0.0
> progress 0.0%, elapsed 80 s, estimated 676952681 s (21 years), iters = {game: 140}, opt = 0.0
> progress 0.0%, elapsed 84 s, estimated 705268022 s (22 years), iters = {game: 141}, opt = 0.0
> progress 0.0%, elapsed 87 s, estimated 732340886 s (23 years), iters = {game: 142}, opt = 0.0
> progress 0.0%, elapsed 90 s, estimated 758031921 s (24 years), iters = {game: 143}, opt = 0.0
> progress 0.0%, elapsed 96 s, estimated 807955161 s (25 years), iters = {game: 145}, opt = 0.0
> progress 0.0%, elapsed 102 s, estimated 857660270 s (27 years), iters = {game: 147}, opt = 0.0
> progress 0.0%, elapsed 107 s, estimated 903333152 s (28 years), iters = {game: 149}, opt = 1.0
> progress 0.0%, elapsed 113 s, estimated 949322099 s (30 years), iters = {game: 151}, opt = 1.0
> progress 0.0%, elapsed 118 s, estimated 997187274 s (31 years), iters = {game: 153}, opt = 1.0
> progress 0.0%, elapsed 124 s, estimated 1044926655 s (33 years), iters = {game: 155}, opt = 1.0
> progress 0.0%, elapsed 130 s, estimated 1093761209 s (34 years), iters = {game: 157}, opt = 1.0
> progress 0.0%, elapsed 136 s, estimated 1145210331 s (36 years), iters = {game: 159}, opt = 1.0
> progress 0.0%, elapsed 142 s, estimated 1192865703 s (37 years), iters = {game: 161}, opt = 1.0
> progress 0.0%, elapsed 145 s, estimated 1219705545 s (38 years), iters = {game: 162}, opt = 1.0
> progress 0.0%, elapsed 151 s, estimated 1270452716 s (40 years), iters = {game: 164}, opt = 1.0
> progress 0.0%, elapsed 154 s, estimated 1297384154 s (41 years), iters = {game: 165}, opt = 1.0
> progress 0.0%, elapsed 157 s, estimated 1324017380 s (41 years), iters = {game: 166}, opt = 1.0
> progress 0.0%, elapsed 161 s, estimated 1352549034 s (42 years), iters = {game: 167}, opt = 1.0
> progress 0.0%, elapsed 164 s, estimated 1380371095 s (43 years), iters = {game: 168}, opt = 1.0
> progress 0.0%, elapsed 168 s, estimated 1410080802 s (44 years), iters = {game: 169}, opt = 1.0
> progress 0.0%, elapsed 171 s, estimated 1440288349 s (45 years), iters = {game: 170}, opt = 1.0
> progress 0.0%, elapsed 175 s, estimated 1471418895 s (46 years), iters = {game: 171}, opt = 1.0
> progress 0.0%, elapsed 179 s, estimated 1502760870 s (47 years), iters = {game: 172}, opt = 1.0
> progress 0.0%, elapsed 182 s, estimated 1534662598 s (48 years), iters = {game: 173}, opt = 1.0
> progress 0.0%, elapsed 186 s, estimated 1565430913 s (49 years), iters = {game: 174}, opt = 1.0
> progress 0.0%, elapsed 190 s, estimated 1600760876 s (50 years), iters = {game: 175}, opt = 1.0
> progress 0.0%, elapsed 196 s, estimated 1645139164 s (52 years), iters = {game: 176}, opt = 1.0
> progress 0.0%, elapsed 199 s, estimated 1675092904 s (53 years), iters = {game: 177}, opt = 1.0
> progress 0.0%, elapsed 204 s, estimated 1717462065 s (54 years), iters = {game: 178}, opt = 1.0
> progress 0.0%, elapsed 210 s, estimated 1763875207 s (55 years), iters = {game: 179}, opt = 1.0
> progress 0.0%, elapsed 215 s, estimated 1809626272 s (57 years), iters = {game: 180}, opt = 1.0
> progress 0.0%, elapsed 219 s, estimated 1839194262 s (58 years), iters = {game: 181}, opt = 1.0
> progress 0.0%, elapsed 222 s, estimated 1869661619 s (59 years), iters = {game: 182}, opt = 1.0
> progress 0.0%, elapsed 234 s, estimated 1966507974 s (62 years), iters = {game: 183}, opt = 1.0
> progress 0.0%, elapsed 239 s, estimated 2005759394 s (63 years), iters = {game: 186}, opt = 1.0
> progress 0.0%, elapsed 244 s, estimated 2048285445 s (64 years), iters = {game: 188}, opt = 1.0
> progress 0.0%, elapsed 247 s, estimated 2074835972 s (65 years), iters = {game: 196}, opt = 1.0
> progress 0.0%, elapsed 250 s, estimated 2101233414 s (66 years), iters = {game: 204}, opt = 1.0
> progress 0.0%, elapsed 253 s, estimated 2129681797 s (67 years), iters = {game: 212}, opt = 1.0
> progress 0.0%, elapsed 256 s, estimated 2152145521 s (68 years), iters = {game: 219}, opt = 1.0
> progress 0.0%, elapsed 265 s, estimated 2207387178 s (69 years), iters = {game: 222}, opt = 1.0
> progress 0.018%, elapsed 268 s, estimated 1464953 s (16 days), iters = {game: 243}, opt = 1.0
--------------------
Synthesis summary:
optimality objective: Pmax=? [F "goal"] 

method: AR, synthesis time: 269.03 s
number of holes: 49, family size: 1e30, quotient: 10976 states / 21421 actions
explored: 100 %
Game stats: avg game size: 6457, iterations: 260

optimum: 1.0
--------------------
A(P0,O0,M0)=up, A(P0,O10,M0)=right, A(P0,O11,M0)=up, A(P0,O12,M0)=up, A(P0,O13,M0)=up, A(P0,O14,M0)=right, A(P0,O30,M0)=up, A(P0,O31,M0)=up, A(P0,O32,M0)=up, A(P0,O36,M0)=right, A(P0,O37,M0)=right, A(P0,O66,M0)=up, A(P0,O67,M0)=up, A(P0,O68,M0)=up, A(P0,O69,M0)=up, A(P0,O71,M0)=right, A(P0,O72,M0)=up, A(P0,O73,M0)=right, A(P0,O74,M0)=right, A(P0,O75,M0)=up, A(P0,O76,M0)=up, A(P0,O78,M0)=right, A(P0,O79,M0)=right, A(P0,O111,M0)=left, A(P0,O112,M0)=left, A(P0,O113,M0)=right, A(P0,O114,M0)=right, A(P0,O115,M0)=up, A(P0,O117,M0)=up, A(P0,O118,M0)=up, A(P0,O121,M0)=right, A(P0,O122,M0)=left, A(P0,O123,M0)=right, A(P0,O124,M0)=right, A(P0,O142,M0)=left, A(P0,O143,M0)=left, A(P0,O144,M0)=left, A(P0,O145,M0)=right, A(P0,O146,M0)=left, A(P0,O147,M0)=left, A(P0,O149,M0)=right, A(P0,O151,M0)=down, A(P0,O158,M0)=left, A(P0,O159,M0)=left, A(P0,O160,M0)=down, A(P0,O33,M0)=up, A(P0,O35,M0)=up, A(P0,O120,M0)=up, A(P1,S0,M0)=model_0
--------------------
Synthesis summary:
constraint 1: P>=1 [F (visit1 & visit2)]

method: None, synthesis time: 269.91 s
number of holes: 4, family size: 81, quotient: 162 states / 594 actions
explored: 0 %

feasible: no
--------------------
None, 269.91, 0, 0
