rocks-8-1-prob, 320, 6, 64, 340282366920938463463374607431768211456, 0.7999999999999999, , 0.0
### CEG-AR ###
no robust policy found
--------------------
Synthesis summary:
constraint 1: P>=4/5 [F (visit1)]

method: None, synthesis time: 300.0 s
number of holes: 2, family size: 64, quotient: 320 states / 4544 actions
explored: 54 %
MDP stats: avg MDP size: 0, iterations: 24246

feasible: no
--------------------
None, 300.0, 24246, 54
### CEG-1by1 ###
> progress 42.989%, elapsed 3 s, estimated 6 s, iters = {DTMC: 1043}
> progress 42.991%, elapsed 6 s, estimated 13 s, iters = {DTMC: 1734}
> progress 42.991%, elapsed 9 s, estimated 20 s, iters = {DTMC: 2129}
> progress 42.991%, elapsed 12 s, estimated 27 s, iters = {DTMC: 2495}
> progress 42.992%, elapsed 15 s, estimated 34 s, iters = {DTMC: 2806}
> progress 43.017%, elapsed 18 s, estimated 41 s, iters = {DTMC: 3097}
> progress 43.017%, elapsed 21 s, estimated 48 s, iters = {DTMC: 3407}
> progress 43.041%, elapsed 24 s, estimated 55 s, iters = {DTMC: 3710}
> progress 43.041%, elapsed 27 s, estimated 62 s, iters = {DTMC: 4015}
> progress 43.041%, elapsed 30 s, estimated 69 s, iters = {DTMC: 4303}
> progress 43.041%, elapsed 33 s, estimated 76 s, iters = {DTMC: 4577}
> progress 43.041%, elapsed 36 s, estimated 83 s, iters = {DTMC: 4843}
> progress 43.041%, elapsed 39 s, estimated 90 s, iters = {DTMC: 5096}
> progress 43.041%, elapsed 42 s, estimated 97 s, iters = {DTMC: 5335}
> progress 43.041%, elapsed 45 s, estimated 104 s, iters = {DTMC: 5546}
> progress 43.041%, elapsed 48 s, estimated 111 s, iters = {DTMC: 5759}
> progress 43.822%, elapsed 51 s, estimated 116 s, iters = {DTMC: 6270}
> progress 43.822%, elapsed 54 s, estimated 123 s, iters = {DTMC: 6927}
> progress 43.822%, elapsed 57 s, estimated 130 s, iters = {DTMC: 7270}
> progress 45.092%, elapsed 60 s, estimated 133 s, iters = {DTMC: 7566}
> progress 45.092%, elapsed 63 s, estimated 139 s, iters = {DTMC: 7777}
> progress 45.092%, elapsed 66 s, estimated 146 s, iters = {DTMC: 8371}
> progress 45.19%, elapsed 69 s, estimated 152 s, iters = {DTMC: 8718}
> progress 45.288%, elapsed 72 s, estimated 159 s, iters = {DTMC: 8946}
> progress 45.3%, elapsed 75 s, estimated 165 s, iters = {DTMC: 9150}
> progress 45.3%, elapsed 78 s, estimated 172 s, iters = {DTMC: 9321}
> progress 45.3%, elapsed 81 s, estimated 179 s, iters = {DTMC: 9516}
> progress 45.3%, elapsed 84 s, estimated 185 s, iters = {DTMC: 9707}
> progress 45.3%, elapsed 87 s, estimated 192 s, iters = {DTMC: 9891}
> progress 45.3%, elapsed 90 s, estimated 199 s, iters = {DTMC: 10079}
> progress 45.3%, elapsed 93 s, estimated 205 s, iters = {DTMC: 10259}
> progress 45.3%, elapsed 96 s, estimated 212 s, iters = {DTMC: 10434}
> progress 45.325%, elapsed 99 s, estimated 218 s, iters = {DTMC: 10605}
> progress 45.325%, elapsed 102 s, estimated 225 s, iters = {DTMC: 10778}
> progress 45.325%, elapsed 105 s, estimated 232 s, iters = {DTMC: 10886}
> progress 45.333%, elapsed 108 s, estimated 238 s, iters = {DTMC: 11144}
> progress 45.431%, elapsed 111 s, estimated 244 s, iters = {DTMC: 11420}
> progress 45.437%, elapsed 114 s, estimated 251 s, iters = {DTMC: 11643}
> progress 45.437%, elapsed 117 s, estimated 258 s, iters = {DTMC: 11810}
> progress 45.437%, elapsed 120 s, estimated 264 s, iters = {DTMC: 11981}
> progress 45.437%, elapsed 123 s, estimated 271 s, iters = {DTMC: 12141}
> progress 45.437%, elapsed 126 s, estimated 278 s, iters = {DTMC: 12351}
> progress 45.439%, elapsed 129 s, estimated 284 s, iters = {DTMC: 12575}
> progress 45.83%, elapsed 132 s, estimated 288 s, iters = {DTMC: 12746}
> progress 45.836%, elapsed 135 s, estimated 295 s, iters = {DTMC: 12903}
> progress 45.836%, elapsed 138 s, estimated 301 s, iters = {DTMC: 13062}
> progress 45.836%, elapsed 141 s, estimated 308 s, iters = {DTMC: 13241}
> progress 45.986%, elapsed 144 s, estimated 314 s, iters = {DTMC: 13725}
> progress 46.755%, elapsed 147 s, estimated 315 s, iters = {DTMC: 14254}
> progress 46.893%, elapsed 150 s, estimated 320 s, iters = {DTMC: 14536}
> progress 47.286%, elapsed 153 s, estimated 324 s, iters = {DTMC: 14797}
> progress 47.286%, elapsed 156 s, estimated 330 s, iters = {DTMC: 15079}
> progress 47.286%, elapsed 159 s, estimated 337 s, iters = {DTMC: 15376}
> progress 47.286%, elapsed 162 s, estimated 343 s, iters = {DTMC: 15655}
> progress 47.701%, elapsed 165 s, estimated 347 s, iters = {DTMC: 15815}
> progress 47.744%, elapsed 168 s, estimated 353 s, iters = {DTMC: 15949}
> progress 47.9%, elapsed 171 s, estimated 358 s, iters = {DTMC: 16218}
> progress 49.002%, elapsed 174 s, estimated 356 s, iters = {DTMC: 16464}
> progress 49.002%, elapsed 177 s, estimated 362 s, iters = {DTMC: 16800}
> progress 49.002%, elapsed 180 s, estimated 368 s, iters = {DTMC: 17139}
> progress 49.229%, elapsed 183 s, estimated 373 s, iters = {DTMC: 17445}
> progress 49.329%, elapsed 186 s, estimated 378 s, iters = {DTMC: 17701}
> progress 49.633%, elapsed 189 s, estimated 382 s, iters = {DTMC: 18019}
> progress 49.892%, elapsed 192 s, estimated 386 s, iters = {DTMC: 18290}
> progress 49.893%, elapsed 195 s, estimated 392 s, iters = {DTMC: 18466}
> progress 49.893%, elapsed 198 s, estimated 398 s, iters = {DTMC: 18622}
> progress 49.99%, elapsed 201 s, estimated 403 s, iters = {DTMC: 18786}
> progress 50.192%, elapsed 204 s, estimated 408 s, iters = {DTMC: 18938}
> progress 50.75%, elapsed 207 s, estimated 409 s, iters = {DTMC: 19215}
> progress 50.888%, elapsed 210 s, estimated 414 s, iters = {DTMC: 19431}
> progress 50.951%, elapsed 213 s, estimated 419 s, iters = {DTMC: 19638}
> progress 51.054%, elapsed 216 s, estimated 424 s, iters = {DTMC: 19825}
> progress 51.054%, elapsed 219 s, estimated 430 s, iters = {DTMC: 19995}
> progress 51.054%, elapsed 223 s, estimated 436 s, iters = {DTMC: 20151}
> progress 51.054%, elapsed 226 s, estimated 442 s, iters = {DTMC: 20305}
> progress 51.061%, elapsed 229 s, estimated 448 s, iters = {DTMC: 20462}
> progress 51.145%, elapsed 232 s, estimated 453 s, iters = {DTMC: 20687}
> progress 51.32%, elapsed 235 s, estimated 458 s, iters = {DTMC: 20886}
> progress 51.434%, elapsed 238 s, estimated 462 s, iters = {DTMC: 21050}
> progress 52.093%, elapsed 241 s, estimated 462 s, iters = {DTMC: 21313}
> progress 52.172%, elapsed 244 s, estimated 467 s, iters = {DTMC: 21607}
> progress 52.172%, elapsed 247 s, estimated 473 s, iters = {DTMC: 21707}
> progress 52.172%, elapsed 250 s, estimated 479 s, iters = {DTMC: 21806}
> progress 52.172%, elapsed 253 s, estimated 485 s, iters = {DTMC: 21893}
> progress 52.172%, elapsed 256 s, estimated 491 s, iters = {DTMC: 21974}
> progress 52.303%, elapsed 259 s, estimated 495 s, iters = {DTMC: 22205}
> progress 52.448%, elapsed 262 s, estimated 499 s, iters = {DTMC: 22438}
> progress 52.612%, elapsed 265 s, estimated 504 s, iters = {DTMC: 22666}
> progress 52.749%, elapsed 268 s, estimated 508 s, iters = {DTMC: 22893}
> progress 52.771%, elapsed 271 s, estimated 514 s, iters = {DTMC: 23289}
> progress 52.771%, elapsed 274 s, estimated 519 s, iters = {DTMC: 23761}
> progress 52.771%, elapsed 277 s, estimated 525 s, iters = {DTMC: 24241}
> progress 52.772%, elapsed 280 s, estimated 531 s, iters = {DTMC: 24519}
> progress 52.772%, elapsed 283 s, estimated 536 s, iters = {DTMC: 24688}
> progress 52.806%, elapsed 286 s, estimated 542 s, iters = {DTMC: 24904}
> progress 52.845%, elapsed 289 s, estimated 547 s, iters = {DTMC: 25097}
> progress 52.869%, elapsed 292 s, estimated 553 s, iters = {DTMC: 25197}
> progress 52.869%, elapsed 295 s, estimated 558 s, iters = {DTMC: 25295}
> progress 52.869%, elapsed 298 s, estimated 564 s, iters = {DTMC: 25390}
no robust policy found
--------------------
Synthesis summary:
constraint 1: P>=4/5 [F (visit1)]

method: None, synthesis time: 300.02 s
number of holes: 2, family size: 64, quotient: 320 states / 4544 actions
explored: 52 %
DTMC stats: avg DTMC size: 101, iterations: 25438

feasible: no
--------------------
None, 300.02, 25438, 52
### AR-1by1 ###
> progress 0.001%, elapsed 3 s, estimated 184333 s (2 days), iters = {MDP: 13678}
> progress 0.001%, elapsed 6 s, estimated 368660 s (4 days), iters = {MDP: 27423}
> progress 0.001%, elapsed 9 s, estimated 552990 s (6 days), iters = {MDP: 41233}
> progress 0.001%, elapsed 12 s, estimated 737367 s (8 days), iters = {MDP: 55238}
> progress 0.001%, elapsed 15 s, estimated 921704 s (10 days), iters = {MDP: 67723}
> progress 0.001%, elapsed 18 s, estimated 1106039 s (12 days), iters = {MDP: 81148}
> progress 0.001%, elapsed 21 s, estimated 1290372 s (14 days), iters = {MDP: 95225}
> progress 0.001%, elapsed 24 s, estimated 1474720 s (17 days), iters = {MDP: 109201}
> progress 0.001%, elapsed 27 s, estimated 1659094 s (19 days), iters = {MDP: 123236}
> progress 0.001%, elapsed 30 s, estimated 1843425 s (21 days), iters = {MDP: 137210}
> progress 0.001%, elapsed 33 s, estimated 2027778 s (23 days), iters = {MDP: 151087}
> progress 0.001%, elapsed 36 s, estimated 2212109 s (25 days), iters = {MDP: 164870}
> progress 0.001%, elapsed 39 s, estimated 2396453 s (27 days), iters = {MDP: 179004}
> progress 0.001%, elapsed 42 s, estimated 2580789 s (29 days), iters = {MDP: 192386}
> progress 0.001%, elapsed 45 s, estimated 2765134 s (32 days), iters = {MDP: 206141}
> progress 0.001%, elapsed 48 s, estimated 2949472 s (34 days), iters = {MDP: 220841}
> progress 0.001%, elapsed 51 s, estimated 3133816 s (36 days), iters = {MDP: 235556}
> progress 0.001%, elapsed 54 s, estimated 3318144 s (38 days), iters = {MDP: 250265}
> progress 0.001%, elapsed 57 s, estimated 3502485 s (40 days), iters = {MDP: 265131}
> progress 0.001%, elapsed 60 s, estimated 3686812 s (42 days), iters = {MDP: 279605}
> progress 0.001%, elapsed 63 s, estimated 3871173 s (44 days), iters = {MDP: 293859}
> progress 0.001%, elapsed 66 s, estimated 4055511 s (46 days), iters = {MDP: 308633}
> progress 0.001%, elapsed 69 s, estimated 4239851 s (49 days), iters = {MDP: 323399}
> progress 0.001%, elapsed 72 s, estimated 4424190 s (51 days), iters = {MDP: 337258}
> progress 0.001%, elapsed 75 s, estimated 4608548 s (53 days), iters = {MDP: 350202}
> progress 0.001%, elapsed 78 s, estimated 4792903 s (55 days), iters = {MDP: 363848}
> progress 0.001%, elapsed 81 s, estimated 4977250 s (57 days), iters = {MDP: 377907}
> progress 0.001%, elapsed 84 s, estimated 5161579 s (59 days), iters = {MDP: 391774}
> progress 0.001%, elapsed 87 s, estimated 5345906 s (61 days), iters = {MDP: 406401}
> progress 0.001%, elapsed 90 s, estimated 5530258 s (64 days), iters = {MDP: 420610}
> progress 0.001%, elapsed 93 s, estimated 5714587 s (66 days), iters = {MDP: 435731}
> progress 0.001%, elapsed 96 s, estimated 5898918 s (68 days), iters = {MDP: 450529}
> progress 0.001%, elapsed 99 s, estimated 6083269 s (70 days), iters = {MDP: 465307}
> progress 0.001%, elapsed 102 s, estimated 6267597 s (72 days), iters = {MDP: 480186}
> progress 0.001%, elapsed 105 s, estimated 6451933 s (74 days), iters = {MDP: 493404}
> progress 0.001%, elapsed 108 s, estimated 6636289 s (76 days), iters = {MDP: 507548}
> progress 0.001%, elapsed 111 s, estimated 6820622 s (78 days), iters = {MDP: 522735}
> progress 0.001%, elapsed 114 s, estimated 7004959 s (81 days), iters = {MDP: 537945}
> progress 0.001%, elapsed 117 s, estimated 7189285 s (83 days), iters = {MDP: 553014}
> progress 0.001%, elapsed 120 s, estimated 7373613 s (85 days), iters = {MDP: 567842}
> progress 0.001%, elapsed 123 s, estimated 7557940 s (87 days), iters = {MDP: 582975}
> progress 0.001%, elapsed 126 s, estimated 7742268 s (89 days), iters = {MDP: 598204}
> progress 0.001%, elapsed 129 s, estimated 7926619 s (91 days), iters = {MDP: 613310}
> progress 0.001%, elapsed 132 s, estimated 8110950 s (93 days), iters = {MDP: 628436}
> progress 0.001%, elapsed 135 s, estimated 8295283 s (96 days), iters = {MDP: 642476}
> progress 0.001%, elapsed 138 s, estimated 8479643 s (98 days), iters = {MDP: 655845}
> progress 0.001%, elapsed 141 s, estimated 8663973 s (100 days), iters = {MDP: 670429}
> progress 0.001%, elapsed 144 s, estimated 8848310 s (102 days), iters = {MDP: 685202}
> progress 0.001%, elapsed 147 s, estimated 9032645 s (104 days), iters = {MDP: 700089}
> progress 0.001%, elapsed 150 s, estimated 9216984 s (106 days), iters = {MDP: 715699}
> progress 0.001%, elapsed 153 s, estimated 9401325 s (108 days), iters = {MDP: 730979}
> progress 0.001%, elapsed 156 s, estimated 9585656 s (110 days), iters = {MDP: 746010}
> progress 0.001%, elapsed 159 s, estimated 9769999 s (113 days), iters = {MDP: 760264}
> progress 0.001%, elapsed 162 s, estimated 9954327 s (115 days), iters = {MDP: 775041}
> progress 0.001%, elapsed 165 s, estimated 10138668 s (117 days), iters = {MDP: 789266}
> progress 0.001%, elapsed 168 s, estimated 10323006 s (119 days), iters = {MDP: 802779}
> progress 0.001%, elapsed 171 s, estimated 10507334 s (121 days), iters = {MDP: 817721}
> progress 0.001%, elapsed 174 s, estimated 10691667 s (123 days), iters = {MDP: 832768}
> progress 0.001%, elapsed 177 s, estimated 10876016 s (125 days), iters = {MDP: 848467}
> progress 0.001%, elapsed 180 s, estimated 11060350 s (128 days), iters = {MDP: 863566}
> progress 0.001%, elapsed 183 s, estimated 11244682 s (130 days), iters = {MDP: 878573}
> progress 0.001%, elapsed 186 s, estimated 11429034 s (132 days), iters = {MDP: 894236}
> progress 0.001%, elapsed 189 s, estimated 11613364 s (134 days), iters = {MDP: 910212}
> progress 0.001%, elapsed 192 s, estimated 11797691 s (136 days), iters = {MDP: 925513}
> progress 0.001%, elapsed 195 s, estimated 11982040 s (138 days), iters = {MDP: 939600}
> progress 0.001%, elapsed 198 s, estimated 12166368 s (140 days), iters = {MDP: 954175}
> progress 0.001%, elapsed 201 s, estimated 12350696 s (142 days), iters = {MDP: 969349}
> progress 0.001%, elapsed 204 s, estimated 12535023 s (145 days), iters = {MDP: 984208}
> progress 0.001%, elapsed 207 s, estimated 12719354 s (147 days), iters = {MDP: 999352}
> progress 0.001%, elapsed 210 s, estimated 12903683 s (149 days), iters = {MDP: 1015312}
> progress 0.001%, elapsed 213 s, estimated 13088015 s (151 days), iters = {MDP: 1030612}
> progress 0.001%, elapsed 216 s, estimated 13272344 s (153 days), iters = {MDP: 1046358}
> progress 0.001%, elapsed 219 s, estimated 13456672 s (155 days), iters = {MDP: 1062262}
> progress 0.001%, elapsed 222 s, estimated 13641002 s (157 days), iters = {MDP: 1077308}
> progress 0.001%, elapsed 225 s, estimated 13825353 s (160 days), iters = {MDP: 1092313}
> progress 0.001%, elapsed 228 s, estimated 14009687 s (162 days), iters = {MDP: 1106975}
> progress 0.001%, elapsed 231 s, estimated 14194028 s (164 days), iters = {MDP: 1122027}
> progress 0.001%, elapsed 234 s, estimated 14378363 s (166 days), iters = {MDP: 1137307}
> progress 0.001%, elapsed 237 s, estimated 14562698 s (168 days), iters = {MDP: 1152530}
> progress 0.001%, elapsed 240 s, estimated 14747024 s (170 days), iters = {MDP: 1168108}
> progress 0.001%, elapsed 243 s, estimated 14931360 s (172 days), iters = {MDP: 1183847}
> progress 0.001%, elapsed 246 s, estimated 15115690 s (174 days), iters = {MDP: 1200002}
> progress 0.001%, elapsed 249 s, estimated 15300019 s (177 days), iters = {MDP: 1215592}
> progress 0.001%, elapsed 252 s, estimated 15484369 s (179 days), iters = {MDP: 1230921}
> progress 0.001%, elapsed 255 s, estimated 15668696 s (181 days), iters = {MDP: 1244770}
> progress 0.001%, elapsed 258 s, estimated 15853029 s (183 days), iters = {MDP: 1259477}
> progress 0.001%, elapsed 261 s, estimated 16037367 s (185 days), iters = {MDP: 1274664}
> progress 0.001%, elapsed 264 s, estimated 16221700 s (187 days), iters = {MDP: 1289880}
> progress 0.001%, elapsed 267 s, estimated 16406036 s (189 days), iters = {MDP: 1305340}
> progress 0.001%, elapsed 270 s, estimated 16590377 s (192 days), iters = {MDP: 1320917}
> progress 0.001%, elapsed 273 s, estimated 16774723 s (194 days), iters = {MDP: 1336890}
> progress 0.001%, elapsed 276 s, estimated 16959057 s (196 days), iters = {MDP: 1353124}
> progress 0.001%, elapsed 279 s, estimated 17143384 s (198 days), iters = {MDP: 1368522}
> progress 0.001%, elapsed 282 s, estimated 17327716 s (200 days), iters = {MDP: 1384314}
> progress 0.001%, elapsed 285 s, estimated 17512055 s (202 days), iters = {MDP: 1398841}
> progress 0.001%, elapsed 288 s, estimated 17696385 s (204 days), iters = {MDP: 1413846}
> progress 0.001%, elapsed 291 s, estimated 17880713 s (206 days), iters = {MDP: 1429844}
> progress 0.001%, elapsed 294 s, estimated 18065043 s (209 days), iters = {MDP: 1445203}
> progress 0.001%, elapsed 297 s, estimated 18249383 s (211 days), iters = {MDP: 1460643}
no robust policy found
--------------------
Synthesis summary:
constraint 1: P>=4/5 [F (visit1)]

method: None, synthesis time: 300.0 s
number of holes: 2, family size: 64, quotient: 320 states / 4544 actions
explored: 0 %
MDP stats: avg MDP size: 81, iterations: 1476284

feasible: no
--------------------
None, 300.0, 1476284, 0
### POSMG ###
created 64 POMDPs
constructed union POSMG with 12290 states and 24452 actions
> progress 0.0%, elapsed 3 s, estimated 3081235 s (35 days), iters = {game: 9}
> progress 0.0%, elapsed 6 s, estimated 6351381 s (73 days), iters = {game: 11}
> progress 0.0%, elapsed 9 s, estimated 9815051 s (113 days), iters = {game: 13}
> progress 0.0%, elapsed 13 s, estimated 13329678 s (154 days), iters = {game: 15}
> progress 0.0%, elapsed 16 s, estimated 16511151 s (191 days), iters = {game: 22}
> progress 0.0%, elapsed 19 s, estimated 19596690 s (226 days), iters = {game: 26}
> progress 0.0%, elapsed 22 s, estimated 22778264 s (263 days), iters = {game: 29}
> progress 0.0%, elapsed 26 s, estimated 26009856 s (301 days), iters = {game: 32}
> progress 0.0%, elapsed 29 s, estimated 29069196 s (336 days), iters = {game: 35}
> progress 0.0%, elapsed 32 s, estimated 32809204 s (1 year), iters = {game: 39}
> progress 0.0%, elapsed 36 s, estimated 36301230 s (1 year), iters = {game: 43}
> progress 0.0%, elapsed 39 s, estimated 39490102 s (1 year), iters = {game: 48}
> progress 0.0%, elapsed 42 s, estimated 42734339 s (1 year), iters = {game: 55}
> progress 0.0%, elapsed 45 s, estimated 5076388777670540969636868476375138304 s (160971232168649837097701605376 years), iters = {game: 72}, opt = 0.0
> progress 0.0%, elapsed 48 s, estimated 7934255378568309890046599677083648 s (251593587600466465406320640 years), iters = {game: 85}, opt = 0.0
> progress 0.0%, elapsed 52 s, estimated 88295817323867147892921242484736 s (2799842000376304527998976 years), iters = {game: 94}, opt = 0.0
> progress 0.0%, elapsed 55 s, estimated 4383703802517843384750437302272 s (139006335696278623617024 years), iters = {game: 101}, opt = 0.0
> progress 0.0%, elapsed 58 s, estimated 96983278276765055736499666944 s (3075319580059774746624 years), iters = {game: 108}, opt = 0.0
> progress 0.0%, elapsed 61 s, estimated 9560167982265436208732569600 s (303150938047483412480 years), iters = {game: 113}, opt = 0.0
> progress 0.0%, elapsed 65 s, estimated 1259058972634297697629634560 s (39924498117525929984 years), iters = {game: 118}, opt = 0.0
> progress 0.0%, elapsed 68 s, estimated 110110986239815496660680704 s (3491596468791714304 years), iters = {game: 122}, opt = 0.0
> progress 0.0%, elapsed 71 s, estimated 21684979179925499371585536 s (687626178967703552 years), iters = {game: 126}, opt = 0.0
> progress 0.0%, elapsed 75 s, estimated 2853365920816319199969280 s (90479639802648368 years), iters = {game: 130}, opt = 0.0
> progress 0.0%, elapsed 79 s, estimated 498965569512590180089856 s (15822094416304864 years), iters = {game: 134}, opt = 0.0
> progress 0.0%, elapsed 82 s, estimated 24489629389554729353216 s (776561053702268 years), iters = {game: 139}, opt = 0.0
> progress 0.0%, elapsed 86 s, estimated 3209267050981269438464 s (101765190606965 years), iters = {game: 143}, opt = 0.0
> progress 0.0%, elapsed 90 s, estimated 830446687563747950592 s (26333291716252 years), iters = {game: 146}, opt = 0.0
> progress 0.0%, elapsed 93 s, estimated 214811595146124066816 s (6811630997784 years), iters = {game: 149}, opt = 0.0
> progress 0.0%, elapsed 96 s, estimated 55497120917666922496 s (1759802159997 years), iters = {game: 152}, opt = 0.0
> progress 0.0%, elapsed 99 s, estimated 9548026300180289536 s (302765927834 years), iters = {game: 156}, opt = 0.0
> progress 0.0%, elapsed 102 s, estimated 2465873567212022272 s (78192337874 years), iters = {game: 159}, opt = 0.0
> progress 0.0%, elapsed 106 s, estimated 637057157146847872 s (20200949934 years), iters = {game: 162}, opt = 0.0
> progress 0.0%, elapsed 109 s, estimated 164440678131591840 s (5214379697 years), iters = {game: 165}, opt = 0.0
> progress 0.0%, elapsed 112 s, estimated 15898361799189760 s (504133745 years), iters = {game: 170}, opt = 0.0
> progress 0.0%, elapsed 116 s, estimated 2732360804340864 s (86642592 years), iters = {game: 174}, opt = 0.0
> progress 0.0%, elapsed 119 s, estimated 525762209604808 s (16671810 years), iters = {game: 178}, opt = 0.0
> progress 0.0%, elapsed 122 s, estimated 2810213429818 s (89111 years), iters = {game: 189}, opt = 0.0
> progress 0.0%, elapsed 126 s, estimated 135985174355 s (4312 years), iters = {game: 198}, opt = 0.0
> progress 0.0%, elapsed 130 s, estimated 131139034208 s (4158 years), iters = {game: 203}, opt = 0.0
> progress 0.0%, elapsed 134 s, estimated 134674122512 s (4270 years), iters = {game: 207}, opt = 0.0
> progress 0.0%, elapsed 137 s, estimated 137931473084 s (4373 years), iters = {game: 211}, opt = 0.0
> progress 0.0%, elapsed 141 s, estimated 141880913852 s (4499 years), iters = {game: 215}, opt = 0.0
> progress 0.0%, elapsed 145 s, estimated 145792492605 s (4623 years), iters = {game: 219}, opt = 0.0
> progress 0.0%, elapsed 149 s, estimated 149511542902 s (4740 years), iters = {game: 223}, opt = 0.0
> progress 0.0%, elapsed 152 s, estimated 153191262445 s (4857 years), iters = {game: 227}, opt = 0.0
> progress 0.0%, elapsed 156 s, estimated 156888554464 s (4974 years), iters = {game: 231}, opt = 0.0
> progress 0.0%, elapsed 160 s, estimated 160518145083 s (5089 years), iters = {game: 235}, opt = 0.0
> progress 0.0%, elapsed 163 s, estimated 164171763223 s (5205 years), iters = {game: 239}, opt = 0.0
> progress 0.0%, elapsed 167 s, estimated 167742865255 s (5319 years), iters = {game: 243}, opt = 0.0
> progress 0.0%, elapsed 170 s, estimated 171016703026 s (5422 years), iters = {game: 247}, opt = 0.0
> progress 0.0%, elapsed 173 s, estimated 174291165324 s (5526 years), iters = {game: 251}, opt = 0.0
> progress 0.0%, elapsed 176 s, estimated 177442816171 s (5626 years), iters = {game: 255}, opt = 0.0
> progress 0.0%, elapsed 180 s, estimated 180507898798 s (5723 years), iters = {game: 259}, opt = 0.0
> progress 0.0%, elapsed 183 s, estimated 183558591557 s (5820 years), iters = {game: 263}, opt = 0.0
> progress 0.0%, elapsed 186 s, estimated 187138723087 s (5934 years), iters = {game: 268}, opt = 0.0
> progress 0.0%, elapsed 190 s, estimated 190618460965 s (6044 years), iters = {game: 273}, opt = 0.0
> progress 0.0%, elapsed 193 s, estimated 194055715458 s (6153 years), iters = {game: 278}, opt = 0.0
> progress 0.0%, elapsed 196 s, estimated 197387977950 s (6259 years), iters = {game: 283}, opt = 0.0
> progress 0.0%, elapsed 199 s, estimated 200503828363 s (6357 years), iters = {game: 288}, opt = 0.0
> progress 0.0%, elapsed 203 s, estimated 203969238792 s (6467 years), iters = {game: 294}, opt = 0.0
> progress 0.0%, elapsed 206 s, estimated 207015226986 s (6564 years), iters = {game: 299}, opt = 0.0
> progress 0.0%, elapsed 209 s, estimated 210525167062 s (6675 years), iters = {game: 305}, opt = 0.0
> progress 0.0%, elapsed 213 s, estimated 213699772626 s (6776 years), iters = {game: 310}, opt = 0.0
> progress 0.0%, elapsed 216 s, estimated 216781706861 s (6874 years), iters = {game: 315}, opt = 0.0
> progress 0.0%, elapsed 219 s, estimated 220273200500 s (6984 years), iters = {game: 321}, opt = 0.0
> progress 0.0%, elapsed 222 s, estimated 223411682169 s (7084 years), iters = {game: 326}, opt = 0.0
> progress 0.0%, elapsed 225 s, estimated 226486268944 s (7181 years), iters = {game: 331}, opt = 0.0
> progress 0.0%, elapsed 229 s, estimated 229684259869 s (7283 years), iters = {game: 336}, opt = 0.0
> progress 0.0%, elapsed 232 s, estimated 232724461921 s (7379 years), iters = {game: 341}, opt = 0.0
> progress 0.0%, elapsed 235 s, estimated 236205448212 s (7490 years), iters = {game: 347}, opt = 0.0
> progress 0.0%, elapsed 239 s, estimated 239693200654 s (7600 years), iters = {game: 353}, opt = 0.0
> progress 0.0%, elapsed 242 s, estimated 243193141441 s (7711 years), iters = {game: 359}, opt = 0.0
> progress 0.0%, elapsed 245 s, estimated 246267785224 s (7809 years), iters = {game: 364}, opt = 0.0
> progress 0.0%, elapsed 249 s, estimated 249706588481 s (7918 years), iters = {game: 370}, opt = 0.0
> progress 0.0%, elapsed 252 s, estimated 252778556970 s (8015 years), iters = {game: 375}, opt = 0.0
> progress 0.0%, elapsed 255 s, estimated 255860876585 s (8113 years), iters = {game: 380}, opt = 0.0
> progress 0.0%, elapsed 258 s, estimated 259131166554 s (8216 years), iters = {game: 385}, opt = 0.0
> progress 0.0%, elapsed 261 s, estimated 262350164290 s (8319 years), iters = {game: 390}, opt = 0.0
> progress 0.0%, elapsed 264 s, estimated 265512200406 s (8419 years), iters = {game: 395}, opt = 0.0
> progress 0.0%, elapsed 268 s, estimated 269041316298 s (8531 years), iters = {game: 401}, opt = 0.2
> progress 0.0%, elapsed 271 s, estimated 272515681940 s (8641 years), iters = {game: 407}, opt = 0.2
> progress 0.0%, elapsed 275 s, estimated 276131285302 s (8756 years), iters = {game: 413}, opt = 0.2
> progress 0.0%, elapsed 278 s, estimated 279238254780 s (8854 years), iters = {game: 418}, opt = 0.2
> progress 0.0%, elapsed 281 s, estimated 282640307037 s (8962 years), iters = {game: 423}, opt = 0.2
> progress 0.0%, elapsed 285 s, estimated 286369445835 s (9080 years), iters = {game: 428}, opt = 0.2
> progress 0.0%, elapsed 289 s, estimated 290056749470 s (9197 years), iters = {game: 433}, opt = 0.2
> progress 0.0%, elapsed 292 s, estimated 293789488577 s (9316 years), iters = {game: 438}, opt = 0.2
> progress 0.0%, elapsed 296 s, estimated 296838625978 s (9412 years), iters = {game: 442}, opt = 0.2
> progress 0.0%, elapsed 299 s, estimated 300012367549 s (9513 years), iters = {game: 446}, opt = 0.2
--------------------
Synthesis summary:
optimality objective: Pmax=? [F "goal"] 

method: AR, synthesis time: 300.01 s
number of holes: 65, family size: 1e40, quotient: 12290 states / 24452 actions
explored: 0 %
Game stats: avg game size: 10183, iterations: 446

optimum: 0.200017
--------------------
A(P0,O0,M0)=up, A(P0,O8,M0)=up, A(P0,O12,M0)=up, A(P0,O19,M0)=up, A(P0,O23,M0)=up, A(P0,O27,M0)=right, A(P0,O35,M0)=up, A(P0,O39,M0)=up, A(P0,O43,M0)=right, A(P0,O47,M0)=right, A(P0,O56,M0)=up, A(P0,O60,M0)=up, A(P0,O64,M0)=right, A(P0,O68,M0)=right, A(P0,O72,M0)=right, A(P0,O82,M0)=up, A(P0,O86,M0)=up, A(P0,O90,M0)=right, A(P0,O94,M0)=right, A(P0,O98,M0)=right, A(P0,O102,M0)=up, A(P0,O113,M0)=up, A(P0,O117,M0)=up, A(P0,O121,M0)=up, A(P0,O125,M0)=right, A(P0,O129,M0)=right, A(P0,O133,M0)=up, A(P0,O137,M0)=right, A(P0,O149,M0)=up, A(P0,O153,M0)=up, A(P0,O157,M0)=up, A(P0,O161,M0)=right, A(P0,O165,M0)=right, A(P0,O169,M0)=right, A(P0,O173,M0)=right, A(P0,O177,M0)=right, A(P0,O188,M0)=left, A(P0,O192,M0)=up, A(P0,O196,M0)=up, A(P0,O200,M0)=right, A(P0,O204,M0)=right, A(P0,O208,M0)=right, A(P0,O214,M0)=right, A(P0,O222,M0)=left, A(P0,O226,M0)=up, A(P0,O230,M0)=up, A(P0,O234,M0)=right, A(P0,O238,M0)=down, A(P0,O242,M0)=right, A(P0,O251,M0)=down, A(P0,O255,M0)=up, A(P0,O259,M0)=right, A(P0,O263,M0)=right, A(P0,O267,M0)=right, A(P0,O275,M0)=down, A(P0,O279,M0)=right, A(P0,O283,M0)=down, A(P0,O287,M0)=right, A(P0,O294,M0)=down, A(P0,O298,M0)=down, A(P0,O302,M0)=down, A(P0,O308,M0)=down, A(P0,O312,M0)=right, A(P0,O317,M0)=down, A(P1,S0,M0)=model_0
--------------------
Synthesis summary:
constraint 1: P>=4/5 [F (visit1)]

method: None, synthesis time: 300.94 s
number of holes: 2, family size: 64, quotient: 320 states / 4544 actions
explored: 0 %

feasible: no
--------------------
None, 300.94, 0, 0
