rocks-4-2-prob, 219, 7, 81, 79228162514264337593543950336, 0.95, , 0.0
### CEG-AR ###
no robust policy found
--------------------
Synthesis summary:
constraint 1: P>=19/20 [F (visit1 & visit2)]

method: None, synthesis time: 300.01 s
number of holes: 4, family size: 81, quotient: 219 states / 651 actions
explored: 118 %
MDP stats: avg MDP size: 0, iterations: 93063

feasible: no
--------------------
None, 300.01, 93063, 118
### CEG-1by1 ###
> progress 17.452%, elapsed 3 s, estimated 17 s, iters = {DTMC: 906}
> progress 30.402%, elapsed 6 s, estimated 19 s, iters = {DTMC: 1774}
> progress 34.752%, elapsed 9 s, estimated 25 s, iters = {DTMC: 2528}
> progress 36.368%, elapsed 12 s, estimated 33 s, iters = {DTMC: 3228}
> progress 40.504%, elapsed 15 s, estimated 37 s, iters = {DTMC: 3949}
> progress 41.498%, elapsed 18 s, estimated 43 s, iters = {DTMC: 4660}
> progress 42.514%, elapsed 21 s, estimated 49 s, iters = {DTMC: 5383}
> progress 43.008%, elapsed 24 s, estimated 55 s, iters = {DTMC: 6161}
> progress 43.071%, elapsed 27 s, estimated 62 s, iters = {DTMC: 7322}
> progress 43.429%, elapsed 30 s, estimated 69 s, iters = {DTMC: 7996}
> progress 43.705%, elapsed 33 s, estimated 75 s, iters = {DTMC: 8586}
> progress 43.756%, elapsed 36 s, estimated 82 s, iters = {DTMC: 9024}
> progress 43.998%, elapsed 39 s, estimated 88 s, iters = {DTMC: 9533}
> progress 44.104%, elapsed 42 s, estimated 95 s, iters = {DTMC: 9973}
> progress 44.119%, elapsed 45 s, estimated 102 s, iters = {DTMC: 10882}
> progress 44.418%, elapsed 48 s, estimated 108 s, iters = {DTMC: 11743}
> progress 44.549%, elapsed 51 s, estimated 114 s, iters = {DTMC: 12429}
> progress 45.351%, elapsed 54 s, estimated 119 s, iters = {DTMC: 12910}
> progress 45.415%, elapsed 57 s, estimated 125 s, iters = {DTMC: 13323}
> progress 45.531%, elapsed 60 s, estimated 131 s, iters = {DTMC: 13856}
> progress 45.538%, elapsed 63 s, estimated 138 s, iters = {DTMC: 14192}
> progress 45.766%, elapsed 66 s, estimated 144 s, iters = {DTMC: 14606}
> progress 46.213%, elapsed 69 s, estimated 149 s, iters = {DTMC: 15097}
> progress 46.246%, elapsed 72 s, estimated 155 s, iters = {DTMC: 15424}
> progress 46.285%, elapsed 75 s, estimated 162 s, iters = {DTMC: 15753}
> progress 46.538%, elapsed 78 s, estimated 167 s, iters = {DTMC: 16355}
> progress 46.545%, elapsed 81 s, estimated 174 s, iters = {DTMC: 17244}
> progress 46.82%, elapsed 84 s, estimated 179 s, iters = {DTMC: 17736}
> progress 46.858%, elapsed 87 s, estimated 185 s, iters = {DTMC: 18523}
> progress 47.198%, elapsed 90 s, estimated 190 s, iters = {DTMC: 18980}
> progress 47.243%, elapsed 93 s, estimated 197 s, iters = {DTMC: 19773}
> progress 47.404%, elapsed 96 s, estimated 202 s, iters = {DTMC: 20293}
> progress 47.43%, elapsed 99 s, estimated 208 s, iters = {DTMC: 20642}
> progress 47.462%, elapsed 102 s, estimated 215 s, iters = {DTMC: 21019}
> progress 47.537%, elapsed 105 s, estimated 221 s, iters = {DTMC: 21406}
> progress 47.571%, elapsed 108 s, estimated 227 s, iters = {DTMC: 21675}
> progress 47.674%, elapsed 111 s, estimated 233 s, iters = {DTMC: 22073}
> progress 47.705%, elapsed 114 s, estimated 239 s, iters = {DTMC: 22353}
> progress 47.846%, elapsed 117 s, estimated 244 s, iters = {DTMC: 22802}
> progress 47.848%, elapsed 120 s, estimated 251 s, iters = {DTMC: 23383}
> progress 47.858%, elapsed 123 s, estimated 257 s, iters = {DTMC: 23976}
> progress 47.955%, elapsed 126 s, estimated 263 s, iters = {DTMC: 24541}
> progress 47.96%, elapsed 129 s, estimated 269 s, iters = {DTMC: 24802}
> progress 49.182%, elapsed 132 s, estimated 268 s, iters = {DTMC: 25143}
> progress 49.763%, elapsed 135 s, estimated 271 s, iters = {DTMC: 25478}
> progress 49.763%, elapsed 138 s, estimated 277 s, iters = {DTMC: 25711}
> progress 49.884%, elapsed 141 s, estimated 283 s, iters = {DTMC: 25992}
> progress 50.216%, elapsed 144 s, estimated 287 s, iters = {DTMC: 26330}
> progress 50.217%, elapsed 147 s, estimated 293 s, iters = {DTMC: 26558}
> progress 50.218%, elapsed 150 s, estimated 299 s, iters = {DTMC: 26935}
> progress 50.352%, elapsed 153 s, estimated 304 s, iters = {DTMC: 27327}
> progress 50.529%, elapsed 156 s, estimated 309 s, iters = {DTMC: 27709}
> progress 50.53%, elapsed 159 s, estimated 315 s, iters = {DTMC: 28074}
> progress 50.635%, elapsed 162 s, estimated 320 s, iters = {DTMC: 28398}
> progress 50.669%, elapsed 165 s, estimated 326 s, iters = {DTMC: 28663}
> progress 50.669%, elapsed 168 s, estimated 332 s, iters = {DTMC: 29089}
> progress 50.669%, elapsed 171 s, estimated 338 s, iters = {DTMC: 29662}
> progress 50.773%, elapsed 174 s, estimated 343 s, iters = {DTMC: 30060}
> progress 50.827%, elapsed 177 s, estimated 348 s, iters = {DTMC: 30362}
> progress 50.827%, elapsed 180 s, estimated 354 s, iters = {DTMC: 30541}
> progress 50.888%, elapsed 183 s, estimated 360 s, iters = {DTMC: 30814}
> progress 50.977%, elapsed 186 s, estimated 365 s, iters = {DTMC: 31135}
> progress 50.977%, elapsed 189 s, estimated 371 s, iters = {DTMC: 31333}
> progress 51.078%, elapsed 192 s, estimated 376 s, iters = {DTMC: 31629}
> progress 51.146%, elapsed 195 s, estimated 382 s, iters = {DTMC: 31991}
> progress 51.146%, elapsed 198 s, estimated 387 s, iters = {DTMC: 32761}
> progress 51.146%, elapsed 201 s, estimated 393 s, iters = {DTMC: 33497}
> progress 51.146%, elapsed 204 s, estimated 399 s, iters = {DTMC: 34069}
> progress 51.189%, elapsed 207 s, estimated 405 s, iters = {DTMC: 34336}
> progress 51.247%, elapsed 210 s, estimated 410 s, iters = {DTMC: 34693}
> progress 51.247%, elapsed 213 s, estimated 416 s, iters = {DTMC: 35107}
> progress 51.392%, elapsed 216 s, estimated 421 s, iters = {DTMC: 35436}
> progress 51.414%, elapsed 219 s, estimated 426 s, iters = {DTMC: 35933}
> progress 51.419%, elapsed 222 s, estimated 432 s, iters = {DTMC: 36393}
> progress 51.491%, elapsed 225 s, estimated 437 s, iters = {DTMC: 36658}
> progress 51.529%, elapsed 228 s, estimated 443 s, iters = {DTMC: 37006}
> progress 51.541%, elapsed 231 s, estimated 449 s, iters = {DTMC: 37398}
> progress 51.556%, elapsed 234 s, estimated 454 s, iters = {DTMC: 37722}
> progress 51.56%, elapsed 237 s, estimated 460 s, iters = {DTMC: 38463}
> progress 51.562%, elapsed 240 s, estimated 466 s, iters = {DTMC: 39325}
> progress 51.565%, elapsed 243 s, estimated 472 s, iters = {DTMC: 40236}
> progress 76.621%, elapsed 246 s, estimated 321 s, iters = {DTMC: 40606}
> progress 76.626%, elapsed 249 s, estimated 325 s, iters = {DTMC: 40952}
> progress 76.626%, elapsed 252 s, estimated 329 s, iters = {DTMC: 41266}
> progress 76.656%, elapsed 255 s, estimated 333 s, iters = {DTMC: 41570}
> progress 76.748%, elapsed 258 s, estimated 336 s, iters = {DTMC: 41795}
> progress 76.81%, elapsed 261 s, estimated 340 s, iters = {DTMC: 42080}
> progress 76.81%, elapsed 264 s, estimated 344 s, iters = {DTMC: 42419}
> progress 76.875%, elapsed 267 s, estimated 348 s, iters = {DTMC: 42625}
> progress 76.875%, elapsed 270 s, estimated 352 s, iters = {DTMC: 42781}
> progress 76.875%, elapsed 273 s, estimated 355 s, iters = {DTMC: 42945}
> progress 76.985%, elapsed 276 s, estimated 359 s, iters = {DTMC: 43194}
> progress 77.07%, elapsed 279 s, estimated 362 s, iters = {DTMC: 43454}
> progress 77.07%, elapsed 282 s, estimated 366 s, iters = {DTMC: 43740}
> progress 77.07%, elapsed 285 s, estimated 370 s, iters = {DTMC: 43996}
> progress 77.07%, elapsed 288 s, estimated 374 s, iters = {DTMC: 44326}
> progress 77.33%, elapsed 291 s, estimated 377 s, iters = {DTMC: 44573}
> progress 77.368%, elapsed 294 s, estimated 380 s, iters = {DTMC: 44810}
> progress 77.369%, elapsed 297 s, estimated 384 s, iters = {DTMC: 44988}
no robust policy found
--------------------
Synthesis summary:
constraint 1: P>=19/20 [F (visit1 & visit2)]

method: None, synthesis time: 300.01 s
number of holes: 4, family size: 81, quotient: 219 states / 651 actions
explored: 77 %
DTMC stats: avg DTMC size: 65, iterations: 45096

feasible: no
--------------------
None, 300.01, 45096, 77
### AR-1by1 ###
> progress 0.024%, elapsed 3 s, estimated 12285 s (3 hours), iters = {MDP: 13320}
> progress 0.024%, elapsed 6 s, estimated 24570 s (6 hours), iters = {MDP: 23493}
> progress 0.024%, elapsed 9 s, estimated 36856 s (10 hours), iters = {MDP: 34490}
> progress 0.024%, elapsed 12 s, estimated 49141 s (13 hours), iters = {MDP: 45202}
> progress 0.024%, elapsed 15 s, estimated 61427 s (17 hours), iters = {MDP: 55814}
> progress 0.024%, elapsed 18 s, estimated 73712 s (20 hours), iters = {MDP: 67132}
> progress 0.024%, elapsed 21 s, estimated 85996 s (23 hours), iters = {MDP: 77760}
> progress 0.024%, elapsed 24 s, estimated 98281 s (27 hours), iters = {MDP: 88249}
> progress 0.024%, elapsed 27 s, estimated 110567 s (30 hours), iters = {MDP: 98862}
> progress 0.024%, elapsed 30 s, estimated 122852 s (34 hours), iters = {MDP: 109707}
> progress 0.024%, elapsed 33 s, estimated 135139 s (37 hours), iters = {MDP: 120045}
> progress 0.024%, elapsed 36 s, estimated 147425 s (40 hours), iters = {MDP: 129878}
> progress 0.024%, elapsed 39 s, estimated 159710 s (44 hours), iters = {MDP: 140222}
> progress 0.024%, elapsed 42 s, estimated 171996 s (47 hours), iters = {MDP: 151088}
> progress 0.024%, elapsed 45 s, estimated 184282 s (2 days), iters = {MDP: 161545}
> progress 0.024%, elapsed 48 s, estimated 196568 s (2 days), iters = {MDP: 172490}
> progress 0.024%, elapsed 51 s, estimated 208853 s (2 days), iters = {MDP: 183225}
> progress 0.024%, elapsed 54 s, estimated 221138 s (2 days), iters = {MDP: 194013}
> progress 0.024%, elapsed 57 s, estimated 233424 s (2 days), iters = {MDP: 205595}
> progress 0.024%, elapsed 60 s, estimated 245709 s (2 days), iters = {MDP: 216647}
> progress 0.024%, elapsed 63 s, estimated 257994 s (2 days), iters = {MDP: 227941}
> progress 0.024%, elapsed 66 s, estimated 270280 s (3 days), iters = {MDP: 239094}
> progress 0.024%, elapsed 69 s, estimated 282566 s (3 days), iters = {MDP: 249263}
> progress 0.024%, elapsed 72 s, estimated 294853 s (3 days), iters = {MDP: 258948}
> progress 0.024%, elapsed 75 s, estimated 307139 s (3 days), iters = {MDP: 269688}
> progress 0.024%, elapsed 78 s, estimated 319424 s (3 days), iters = {MDP: 280890}
> progress 0.024%, elapsed 81 s, estimated 331709 s (3 days), iters = {MDP: 291634}
> progress 0.024%, elapsed 84 s, estimated 343995 s (3 days), iters = {MDP: 302567}
> progress 0.024%, elapsed 87 s, estimated 356280 s (4 days), iters = {MDP: 313841}
> progress 0.024%, elapsed 90 s, estimated 368565 s (4 days), iters = {MDP: 325155}
> progress 0.024%, elapsed 93 s, estimated 380850 s (4 days), iters = {MDP: 335854}
> progress 0.024%, elapsed 96 s, estimated 393135 s (4 days), iters = {MDP: 346630}
> progress 0.024%, elapsed 99 s, estimated 405421 s (4 days), iters = {MDP: 356892}
> progress 0.024%, elapsed 102 s, estimated 417707 s (4 days), iters = {MDP: 366666}
> progress 0.024%, elapsed 105 s, estimated 429992 s (4 days), iters = {MDP: 376818}
> progress 0.024%, elapsed 108 s, estimated 442277 s (5 days), iters = {MDP: 387098}
> progress 0.024%, elapsed 111 s, estimated 454562 s (5 days), iters = {MDP: 397164}
> progress 0.024%, elapsed 114 s, estimated 466848 s (5 days), iters = {MDP: 407708}
> progress 0.024%, elapsed 117 s, estimated 479134 s (5 days), iters = {MDP: 417398}
> progress 0.024%, elapsed 120 s, estimated 491420 s (5 days), iters = {MDP: 428172}
> progress 0.024%, elapsed 123 s, estimated 503705 s (5 days), iters = {MDP: 439816}
> progress 0.024%, elapsed 126 s, estimated 515990 s (5 days), iters = {MDP: 450919}
> progress 0.024%, elapsed 129 s, estimated 528276 s (6 days), iters = {MDP: 462014}
> progress 0.024%, elapsed 132 s, estimated 540562 s (6 days), iters = {MDP: 472158}
> progress 0.024%, elapsed 135 s, estimated 552848 s (6 days), iters = {MDP: 482658}
> progress 0.024%, elapsed 138 s, estimated 565134 s (6 days), iters = {MDP: 493125}
> progress 0.024%, elapsed 141 s, estimated 577419 s (6 days), iters = {MDP: 504033}
> progress 0.024%, elapsed 144 s, estimated 589705 s (6 days), iters = {MDP: 514748}
> progress 0.024%, elapsed 147 s, estimated 601990 s (6 days), iters = {MDP: 525593}
> progress 0.024%, elapsed 150 s, estimated 614276 s (7 days), iters = {MDP: 536790}
> progress 0.024%, elapsed 153 s, estimated 626560 s (7 days), iters = {MDP: 548083}
> progress 0.024%, elapsed 156 s, estimated 638846 s (7 days), iters = {MDP: 559296}
> progress 0.024%, elapsed 159 s, estimated 651132 s (7 days), iters = {MDP: 570626}
> progress 0.024%, elapsed 162 s, estimated 663417 s (7 days), iters = {MDP: 582308}
> progress 0.024%, elapsed 165 s, estimated 675702 s (7 days), iters = {MDP: 593999}
> progress 0.024%, elapsed 168 s, estimated 687988 s (7 days), iters = {MDP: 606156}
> progress 0.024%, elapsed 171 s, estimated 700273 s (8 days), iters = {MDP: 617566}
> progress 0.024%, elapsed 174 s, estimated 712558 s (8 days), iters = {MDP: 629534}
> progress 0.024%, elapsed 177 s, estimated 724841 s (8 days), iters = {MDP: 640706}
> progress 0.024%, elapsed 180 s, estimated 737126 s (8 days), iters = {MDP: 652295}
> progress 0.024%, elapsed 183 s, estimated 749410 s (8 days), iters = {MDP: 663919}
> progress 0.024%, elapsed 186 s, estimated 761695 s (8 days), iters = {MDP: 674710}
> progress 0.024%, elapsed 189 s, estimated 773977 s (8 days), iters = {MDP: 686449}
> progress 0.024%, elapsed 192 s, estimated 786262 s (9 days), iters = {MDP: 696195}
> progress 0.024%, elapsed 195 s, estimated 798548 s (9 days), iters = {MDP: 705788}
> progress 0.024%, elapsed 198 s, estimated 810833 s (9 days), iters = {MDP: 715544}
> progress 0.024%, elapsed 201 s, estimated 823118 s (9 days), iters = {MDP: 726281}
> progress 0.024%, elapsed 204 s, estimated 835404 s (9 days), iters = {MDP: 737230}
> progress 0.024%, elapsed 207 s, estimated 847689 s (9 days), iters = {MDP: 747992}
> progress 0.024%, elapsed 210 s, estimated 859974 s (9 days), iters = {MDP: 759170}
> progress 0.024%, elapsed 213 s, estimated 872259 s (10 days), iters = {MDP: 770088}
> progress 0.024%, elapsed 216 s, estimated 884543 s (10 days), iters = {MDP: 780986}
> progress 0.024%, elapsed 219 s, estimated 896828 s (10 days), iters = {MDP: 792638}
> progress 0.024%, elapsed 222 s, estimated 909113 s (10 days), iters = {MDP: 803936}
> progress 0.024%, elapsed 225 s, estimated 921397 s (10 days), iters = {MDP: 814663}
> progress 0.024%, elapsed 228 s, estimated 933682 s (10 days), iters = {MDP: 824664}
> progress 0.024%, elapsed 231 s, estimated 945967 s (10 days), iters = {MDP: 835432}
> progress 0.024%, elapsed 234 s, estimated 958252 s (11 days), iters = {MDP: 846407}
> progress 0.024%, elapsed 237 s, estimated 970544 s (11 days), iters = {MDP: 857061}
> progress 0.024%, elapsed 240 s, estimated 982829 s (11 days), iters = {MDP: 867513}
> progress 0.024%, elapsed 243 s, estimated 995115 s (11 days), iters = {MDP: 877853}
> progress 0.024%, elapsed 246 s, estimated 1007400 s (11 days), iters = {MDP: 888228}
> progress 0.024%, elapsed 249 s, estimated 1019684 s (11 days), iters = {MDP: 898786}
> progress 0.024%, elapsed 252 s, estimated 1031969 s (11 days), iters = {MDP: 909392}
> progress 0.024%, elapsed 255 s, estimated 1044255 s (12 days), iters = {MDP: 920260}
> progress 0.024%, elapsed 258 s, estimated 1056539 s (12 days), iters = {MDP: 931487}
> progress 0.024%, elapsed 261 s, estimated 1068823 s (12 days), iters = {MDP: 941312}
> progress 0.024%, elapsed 264 s, estimated 1081108 s (12 days), iters = {MDP: 951100}
> progress 0.024%, elapsed 267 s, estimated 1093394 s (12 days), iters = {MDP: 961469}
> progress 0.024%, elapsed 270 s, estimated 1105679 s (12 days), iters = {MDP: 972389}
> progress 0.024%, elapsed 273 s, estimated 1117964 s (12 days), iters = {MDP: 982718}
> progress 0.024%, elapsed 276 s, estimated 1130249 s (13 days), iters = {MDP: 993962}
> progress 0.024%, elapsed 279 s, estimated 1142530 s (13 days), iters = {MDP: 1005284}
> progress 0.024%, elapsed 282 s, estimated 1154810 s (13 days), iters = {MDP: 1016474}
> progress 0.024%, elapsed 285 s, estimated 1167095 s (13 days), iters = {MDP: 1026832}
> progress 0.024%, elapsed 288 s, estimated 1179380 s (13 days), iters = {MDP: 1037540}
> progress 0.024%, elapsed 291 s, estimated 1191665 s (13 days), iters = {MDP: 1048516}
> progress 0.024%, elapsed 294 s, estimated 1203950 s (13 days), iters = {MDP: 1059203}
> progress 0.024%, elapsed 297 s, estimated 1216236 s (14 days), iters = {MDP: 1070029}
no robust policy found
--------------------
Synthesis summary:
constraint 1: P>=19/20 [F (visit1 & visit2)]

method: None, synthesis time: 300.01 s
number of holes: 4, family size: 81, quotient: 219 states / 651 actions
explored: 0 %
MDP stats: avg MDP size: 149, iterations: 1080801

feasible: no
--------------------
None, 300.01, 1080801, 0
### POSMG ###
created 81 POMDPs
constructed union POSMG with 14503 states and 24948 actions
> progress 0.0%, elapsed 3 s, estimated 3160097 s (36 days), iters = {game: 14}
> progress 0.0%, elapsed 6 s, estimated 6448588 s (74 days), iters = {game: 21}
> progress 0.0%, elapsed 9 s, estimated 9806214 s (113 days), iters = {game: 30}
> progress 0.0%, elapsed 13 s, estimated 13060154 s (151 days), iters = {game: 40}
> progress 0.0%, elapsed 16 s, estimated 608633438223512012587008 s (19299639720431000 years), iters = {game: 49}, opt = 0.0
> progress 0.0%, elapsed 19 s, estimated 355395310983986544640 s (11269511383307 years), iters = {game: 61}, opt = 0.0
> progress 0.0%, elapsed 22 s, estimated 812137241510019072 s (25752702990 years), iters = {game: 72}, opt = 0.0
> progress 0.0%, elapsed 25 s, estimated 3599841936409088 s (114150238 years), iters = {game: 81}, opt = 0.0
> progress 0.0%, elapsed 28 s, estimated 15884559360090 s (503696 years), iters = {game: 90}, opt = 0.0
> progress 0.0%, elapsed 32 s, estimated 276757115999 s (8775 years), iters = {game: 98}, opt = 0.0
> progress 0.0%, elapsed 36 s, estimated 154917202392 s (4912 years), iters = {game: 103}, opt = 0.0
> progress 0.0%, elapsed 39 s, estimated 165296114428 s (5241 years), iters = {game: 107}, opt = 0.0
> progress 0.0%, elapsed 42 s, estimated 179514894653 s (5692 years), iters = {game: 111}, opt = 0.0
> progress 0.0%, elapsed 46 s, estimated 194913202349 s (6180 years), iters = {game: 116}, opt = 0.0
> progress 0.0%, elapsed 49 s, estimated 208079587705 s (6598 years), iters = {game: 121}, opt = 0.0
> progress 0.0%, elapsed 52 s, estimated 221277194967 s (7016 years), iters = {game: 127}, opt = 0.0
> progress 0.0%, elapsed 55 s, estimated 235344224476 s (7462 years), iters = {game: 134}, opt = 0.0863
> progress 0.0%, elapsed 58 s, estimated 248229900991 s (7871 years), iters = {game: 140}, opt = 0.0863
> progress 0.0%, elapsed 61 s, estimated 261203275416 s (8282 years), iters = {game: 146}, opt = 0.0863
> progress 0.0%, elapsed 65 s, estimated 275959280406 s (8750 years), iters = {game: 152}, opt = 0.0863
> progress 0.0%, elapsed 68 s, estimated 289400892393 s (9176 years), iters = {game: 157}, opt = 0.0863
> progress 0.0%, elapsed 71 s, estimated 304196522652 s (9646 years), iters = {game: 162}, opt = 0.0863
> progress 0.0%, elapsed 75 s, estimated 319203597859 s (10121 years), iters = {game: 167}, opt = 0.0863
> progress 0.0%, elapsed 78 s, estimated 333924784429 s (10588 years), iters = {game: 172}, opt = 0.0863
> progress 0.0%, elapsed 82 s, estimated 349505342858 s (11082 years), iters = {game: 177}, opt = 0.0863
> progress 0.0%, elapsed 85 s, estimated 362146639501 s (11483 years), iters = {game: 181}, opt = 0.0863
> progress 0.0%, elapsed 88 s, estimated 375644448641 s (11911 years), iters = {game: 185}, opt = 0.0863
> progress 0.0%, elapsed 92 s, estimated 391069994830 s (12400 years), iters = {game: 190}, opt = 0.0863
> progress 0.0%, elapsed 95 s, estimated 404796395254 s (12836 years), iters = {game: 195}, opt = 0.0863
> progress 0.0%, elapsed 99 s, estimated 418847145838 s (13281 years), iters = {game: 201}, opt = 0.0863
> progress 0.0%, elapsed 102 s, estimated 432081216290 s (13701 years), iters = {game: 207}, opt = 0.0982
> progress 0.0%, elapsed 105 s, estimated 445464200537 s (14125 years), iters = {game: 213}, opt = 0.0982
> progress 0.0%, elapsed 108 s, estimated 458677409062 s (14544 years), iters = {game: 219}, opt = 0.0982
> progress 0.0%, elapsed 111 s, estimated 473501937147 s (15014 years), iters = {game: 225}, opt = 0.0982
> progress 0.0%, elapsed 115 s, estimated 486926947890 s (15440 years), iters = {game: 230}, opt = 0.0982
> progress 0.0%, elapsed 118 s, estimated 501220028976 s (15893 years), iters = {game: 235}, opt = 0.0982
> progress 0.0%, elapsed 122 s, estimated 516028631401 s (16363 years), iters = {game: 240}, opt = 0.0982
> progress 0.0%, elapsed 125 s, estimated 531487814749 s (16853 years), iters = {game: 245}, opt = 0.0982
> progress 0.0%, elapsed 128 s, estimated 544551131603 s (17267 years), iters = {game: 249}, opt = 0.0982
> progress 0.0%, elapsed 131 s, estimated 557868349896 s (17689 years), iters = {game: 253}, opt = 0.0982
> progress 0.0%, elapsed 134 s, estimated 569664251855 s (18063 years), iters = {game: 257}, opt = 0.0982
> progress 0.0%, elapsed 138 s, estimated 582105130677 s (18458 years), iters = {game: 261}, opt = 0.0982
> progress 0.0%, elapsed 141 s, estimated 595243038199 s (18875 years), iters = {game: 265}, opt = 0.0982
> progress 0.0%, elapsed 144 s, estimated 609770424094 s (19335 years), iters = {game: 270}, opt = 0.0982
> progress 0.0%, elapsed 148 s, estimated 624636042503 s (19807 years), iters = {game: 276}, opt = 0.0982
> progress 0.0%, elapsed 151 s, estimated 639061772410 s (20264 years), iters = {game: 283}, opt = 0.2141
> progress 0.0%, elapsed 155 s, estimated 653721033572 s (20729 years), iters = {game: 290}, opt = 0.2141
> progress 0.0%, elapsed 158 s, estimated 667083286575 s (21153 years), iters = {game: 296}, opt = 0.2141
> progress 0.0%, elapsed 161 s, estimated 681851114339 s (21621 years), iters = {game: 302}, opt = 0.2141
> progress 0.0%, elapsed 165 s, estimated 695533294016 s (22055 years), iters = {game: 307}, opt = 0.2141
> progress 0.0%, elapsed 168 s, estimated 709948075693 s (22512 years), iters = {game: 312}, opt = 0.2141
> progress 0.0%, elapsed 172 s, estimated 725192034082 s (22995 years), iters = {game: 317}, opt = 0.2141
> progress 0.0%, elapsed 175 s, estimated 739917478765 s (23462 years), iters = {game: 322}, opt = 0.2141
> progress 0.0%, elapsed 179 s, estimated 754653876270 s (23929 years), iters = {game: 327}, opt = 0.2141
> progress 0.0%, elapsed 182 s, estimated 767045430231 s (24322 years), iters = {game: 331}, opt = 0.2141
> progress 0.0%, elapsed 185 s, estimated 774579646980 s (24561 years), iters = {game: 335}, opt = 0.2141
> progress 0.0%, elapsed 189 s, estimated 788123346249 s (24991 years), iters = {game: 339}, opt = 0.2141
> progress 0.0%, elapsed 192 s, estimated 800676076774 s (25389 years), iters = {game: 343}, opt = 0.2141
> progress 0.0%, elapsed 195 s, estimated 814879229432 s (25839 years), iters = {game: 348}, opt = 0.2141
> progress 0.0%, elapsed 198 s, estimated 828527245375 s (26272 years), iters = {game: 354}, opt = 0.2141
> progress 0.0%, elapsed 202 s, estimated 842098614049 s (26702 years), iters = {game: 361}, opt = 0.222
> progress 0.0%, elapsed 205 s, estimated 856357372417 s (27154 years), iters = {game: 368}, opt = 0.222
> progress 0.0%, elapsed 208 s, estimated 868875596493 s (27551 years), iters = {game: 374}, opt = 0.222
> progress 0.0%, elapsed 211 s, estimated 882410420325 s (27981 years), iters = {game: 380}, opt = 0.222
> progress 0.0%, elapsed 215 s, estimated 897531877133 s (28460 years), iters = {game: 386}, opt = 0.222
> progress 0.0%, elapsed 218 s, estimated 910934406042 s (28885 years), iters = {game: 391}, opt = 0.222
> progress 0.0%, elapsed 222 s, estimated 925625939016 s (29351 years), iters = {game: 396}, opt = 0.222
> progress 0.0%, elapsed 225 s, estimated 940667163972 s (29828 years), iters = {game: 401}, opt = 0.222
> progress 0.0%, elapsed 229 s, estimated 955910350819 s (30311 years), iters = {game: 406}, opt = 0.222
> progress 0.0%, elapsed 232 s, estimated 968192898420 s (30701 years), iters = {game: 410}, opt = 0.222
> progress 0.0%, elapsed 235 s, estimated 981629680263 s (31127 years), iters = {game: 414}, opt = 0.222
> progress 0.0%, elapsed 239 s, estimated 996812029553 s (31608 years), iters = {game: 419}, opt = 0.222
> progress 0.0%, elapsed 242 s, estimated 1009600975369 s (32014 years), iters = {game: 424}, opt = 0.222
> progress 0.0%, elapsed 245 s, estimated 1022801025515 s (32432 years), iters = {game: 430}, opt = 0.222
> progress 0.0%, elapsed 249 s, estimated 1037231896510 s (32890 years), iters = {game: 437}, opt = 0.2477
> progress 0.0%, elapsed 252 s, estimated 1051449168266 s (33341 years), iters = {game: 443}, opt = 0.2477
> progress 0.0%, elapsed 255 s, estimated 1065720638749 s (33793 years), iters = {game: 449}, opt = 0.2477
> progress 0.0%, elapsed 259 s, estimated 1078857183323 s (34210 years), iters = {game: 454}, opt = 0.2477
> progress 0.0%, elapsed 262 s, estimated 1092898662739 s (34655 years), iters = {game: 459}, opt = 0.2477
> progress 0.0%, elapsed 266 s, estimated 1108333464167 s (35145 years), iters = {game: 464}, opt = 0.2477
> progress 0.0%, elapsed 269 s, estimated 1120981079775 s (35546 years), iters = {game: 468}, opt = 0.2477
> progress 0.0%, elapsed 272 s, estimated 1136352378475 s (36033 years), iters = {game: 473}, opt = 0.2477
> progress 0.0%, elapsed 276 s, estimated 1149149721232 s (36439 years), iters = {game: 477}, opt = 0.2477
> progress 0.0%, elapsed 279 s, estimated 1163173501306 s (36883 years), iters = {game: 481}, opt = 0.2477
> progress 0.0%, elapsed 282 s, estimated 1176672999256 s (37312 years), iters = {game: 485}, opt = 0.2477
> progress 0.0%, elapsed 286 s, estimated 1191340419729 s (37777 years), iters = {game: 490}, opt = 0.2477
> progress 0.0%, elapsed 289 s, estimated 1205899440350 s (38238 years), iters = {game: 496}, opt = 0.2477
> progress 0.0%, elapsed 292 s, estimated 1218720439837 s (38645 years), iters = {game: 502}, opt = 0.2519
> progress 0.0%, elapsed 296 s, estimated 1232875081671 s (39094 years), iters = {game: 508}, opt = 0.2519
> progress 0.0%, elapsed 299 s, estimated 1247351734399 s (39553 years), iters = {game: 514}, opt = 0.2519
--------------------
Synthesis summary:
optimality objective: Pmax=? [F "goal"] 

method: AR, synthesis time: 300.43 s
number of holes: 49, family size: 1e30, quotient: 14503 states / 24948 actions
explored: 0 %
Game stats: avg game size: 8412, iterations: 514

optimum: 0.25194
--------------------
A(P0,O0,M0)=up, A(P0,O11,M0)=right, A(P0,O14,M0)=up, A(P0,O16,M0)=up, A(P0,O18,M0)=up, A(P0,O20,M0)=right, A(P0,O37,M0)=down, A(P0,O39,M0)=down, A(P0,O41,M0)=up, A(P0,O49,M0)=right, A(P0,O51,M0)=right, A(P0,O81,M0)=down, A(P0,O83,M0)=up, A(P0,O85,M0)=up, A(P0,O87,M0)=up, A(P0,O91,M0)=down, A(P0,O93,M0)=up, A(P0,O95,M0)=right, A(P0,O97,M0)=right, A(P0,O99,M0)=up, A(P0,O101,M0)=up, A(P0,O105,M0)=right, A(P0,O107,M0)=right, A(P0,O140,M0)=up, A(P0,O142,M0)=left, A(P0,O144,M0)=left, A(P0,O146,M0)=right, A(P0,O148,M0)=up, A(P0,O152,M0)=up, A(P0,O154,M0)=up, A(P0,O160,M0)=right, A(P0,O162,M0)=left, A(P0,O164,M0)=right, A(P0,O166,M0)=right, A(P0,O186,M0)=left, A(P0,O188,M0)=down, A(P0,O190,M0)=up, A(P0,O192,M0)=right, A(P0,O194,M0)=down, A(P0,O196,M0)=left, A(P0,O200,M0)=right, A(P0,O204,M0)=down, A(P0,O212,M0)=down, A(P0,O214,M0)=left, A(P0,O216,M0)=down, A(P0,O43,M0)=up, A(P0,O47,M0)=right, A(P0,O158,M0)=right, A(P1,S0,M0)=model_0
--------------------
Synthesis summary:
constraint 1: P>=19/20 [F (visit1 & visit2)]

method: None, synthesis time: 301.66 s
number of holes: 4, family size: 81, quotient: 219 states / 651 actions
explored: 0 %

feasible: no
--------------------
None, 301.66, 0, 0
