2025-02-06 19:07:16,771 - cli.py:170 - This is Paynt version 0.1.0.
2025-02-06 19:07:16,771 - sketch.py:84 - loading sketch from /home/fpmk/synthesis-playground/models/dts-uai-subset/undiscounted/pacman-30/model.prism ...
2025-02-06 19:07:16,771 - sketch.py:88 - assuming sketch in PRISM format...
2025-02-06 19:07:16,815 - prism_parser.py:31 - PRISM model type: MDP
2025-02-06 19:07:16,817 - prism_parser.py:202 - loading properties from /home/fpmk/synthesis-playground/models/dts-uai-subset/undiscounted/pacman-30/model.props ...
2025-02-06 19:07:16,818 - prism_parser.py:218 - found the following specification: optimality: Pmin=? [F "Crash"] 
2025-02-06 19:07:30,966 - sketch.py:149 - sketch parsing OK
2025-02-06 19:07:30,996 - sketch.py:154 - tree helper loaded
2025-02-06 19:07:32,120 - sketch.py:170 - constructed explicit quotient having 853166 states and 1072421 choices
2025-02-06 19:07:32,121 - sketch.py:176 - found the following specification optimality: Pmin=? [F "Crash"] 
2025-02-06 19:07:35,338 - mdp.py:497 - MDP has 75162/853166 relevant states
2025-02-06 19:07:35,367 - mdp.py:501 - adding explicit don't-care action to relevant states...
2025-02-06 19:07:36,781 - mdp.py:507 - MDP has 12 actions
2025-02-06 19:07:42,699 - mdp.py:532 - found the following 10 variables: ['dG0:[0..3]', 'dG1:[0..3]', 'dP:[0..3]', 'steps:[2..29]', 'xG0:[0..10]', 'xG1:[0..10]', 'xP:[1..10]', 'yG0:[0..6]', 'yG1:[0..6]', 'yP:[1..6]']
2025-02-06 19:07:43,024 - decision_tree.py:609 - the optimal scheduler has value: 0.5511
2025-02-06 19:07:45,125 - decision_tree.py:616 - the random scheduler has value: 0.9589366689945393
2025-02-06 19:07:45,125 - synthesizer.py:109 - optimality threshold set to 0.5918836668994539

2025-02-06 19:07:45,125 - mdp.py:825 - building tree of depth 0
2025-02-06 19:07:46,255 - statistic.py:67 - synthesis initiated, design space: 12
> progress 16.666%, elapsed 4 s, estimated 25 s, iters = {MDP: 4}, opt = 0.5919
--------------------
Synthesis summary:
optimality objective: Pmin=? [F "Crash"] 

method: AR (decision tree), synthesis time: 4.6 s
number of holes: 1, family size: 12, quotient: 853166 states / 1147583 actions
explored: 100 %
MDP stats: avg MDP size: 427589, iterations: 4

optimum: 0.591884
--------------------
2025-02-06 19:07:50,851 - decision_tree.py:120 - families considered: 4
2025-02-06 19:07:50,852 - decision_tree.py:121 - families skipped by construction: 0
2025-02-06 19:07:50,852 - decision_tree.py:122 - families with schedulers preserved: 0
2025-02-06 19:07:50,852 - decision_tree.py:123 - families model checked: 4
2025-02-06 19:07:50,852 - decision_tree.py:124 - harmonizations attempted: 1
2025-02-06 19:07:50,852 - decision_tree.py:125 - harmonizations succeeded: 0


2025-02-06 19:07:50,852 - mdp.py:825 - building tree of depth 1
2025-02-06 19:07:55,610 - statistic.py:67 - synthesis initiated, design space: 1e11
> progress 0.0%, elapsed 3 s, estimated 3884758 s (44 days), iters = {MDP: 2}, opt = 0.5919
> progress 0.972%, elapsed 7 s, estimated 811 s, iters = {MDP: 7}, opt = 0.5919
> progress 1.666%, elapsed 12 s, estimated 740 s, iters = {MDP: 10}, opt = 0.5919
> progress 1.805%, elapsed 16 s, estimated 900 s, iters = {MDP: 14}, opt = 0.5919
> progress 2.345%, elapsed 19 s, estimated 840 s, iters = {MDP: 16}, opt = 0.5919
> progress 3.333%, elapsed 24 s, estimated 735 s, iters = {MDP: 21}, opt = 0.5919
> progress 3.472%, elapsed 28 s, estimated 815 s, iters = {MDP: 25}, opt = 0.5919
> progress 3.819%, elapsed 32 s, estimated 853 s, iters = {MDP: 27}, opt = 0.5919
> progress 5.277%, elapsed 35 s, estimated 680 s, iters = {MDP: 31}, opt = 0.5919
> progress 5.555%, elapsed 42 s, estimated 763 s, iters = {MDP: 33}, opt = 0.5919
2025-02-06 19:08:38,064 - synthesizer.py:93 - time limit reached, aborting...
--------------------
Synthesis summary:
optimality objective: Pmin=? [F "Crash"] 

method: AR (decision tree), synthesis time: 45.39 s
number of holes: 13, family size: 1e11, quotient: 853166 states / 1147583 actions
explored: 5 %
MDP stats: avg MDP size: 489011, iterations: 33

optimum: 0.591884
--------------------
2025-02-06 19:08:38,064 - decision_tree.py:120 - families considered: 33
2025-02-06 19:08:38,064 - decision_tree.py:121 - families skipped by construction: 0
2025-02-06 19:08:38,064 - decision_tree.py:122 - families with schedulers preserved: 4
2025-02-06 19:08:38,064 - decision_tree.py:123 - families model checked: 29
2025-02-06 19:08:38,064 - decision_tree.py:124 - harmonizations attempted: 10
2025-02-06 19:08:38,064 - decision_tree.py:125 - harmonizations succeeded: 0


2025-02-06 19:08:38,064 - mdp.py:825 - building tree of depth 2
2025-02-06 19:08:45,960 - statistic.py:67 - synthesis initiated, design space: 1e31
> progress 0.0%, elapsed 3 s, estimated 3639087 s (42 days), iters = {MDP: 2}, opt = 0.5919
> progress 0.0%, elapsed 7 s, estimated 7106072 s (82 days), iters = {MDP: 4}, opt = 0.5919
> progress 0.0%, elapsed 10 s, estimated 10445070 s (120 days), iters = {MDP: 6}, opt = 0.5919
> progress 0.0%, elapsed 13 s, estimated 20004751 s (231 days), iters = {MDP: 10}, opt = 0.5919
> progress 0.0%, elapsed 17 s, estimated 25213724 s (291 days), iters = {MDP: 12}, opt = 0.5919
> progress 0.0%, elapsed 20 s, estimated 28789443 s (333 days), iters = {MDP: 19}, opt = 0.5919
> progress 0.0%, elapsed 24 s, estimated 30915449 s (357 days), iters = {MDP: 23}, opt = 0.5919
> progress 0.0%, elapsed 29 s, estimated 3551128 s (41 days), iters = {MDP: 27}, opt = 0.5919
> progress 0.0%, elapsed 34 s, estimated 4145303 s (47 days), iters = {MDP: 29}, opt = 0.5919
> progress 0.0%, elapsed 38 s, estimated 4272705 s (49 days), iters = {MDP: 32}, opt = 0.5919
> progress 0.0%, elapsed 42 s, estimated 4658062 s (53 days), iters = {MDP: 34}, opt = 0.5919
2025-02-06 19:09:28,537 - synthesizer.py:93 - time limit reached, aborting...
--------------------
Synthesis summary:
optimality objective: Pmin=? [F "Crash"] 

method: AR (decision tree), synthesis time: 45.53 s
number of holes: 37, family size: 1e31, quotient: 853166 states / 1147583 actions
explored: 0 %
MDP stats: avg MDP size: 473610, iterations: 39

optimum: 0.591884
--------------------
2025-02-06 19:09:28,553 - decision_tree.py:120 - families considered: 39
2025-02-06 19:09:28,554 - decision_tree.py:121 - families skipped by construction: 0
2025-02-06 19:09:28,554 - decision_tree.py:122 - families with schedulers preserved: 9
2025-02-06 19:09:28,554 - decision_tree.py:123 - families model checked: 30
2025-02-06 19:09:28,554 - decision_tree.py:124 - harmonizations attempted: 10
2025-02-06 19:09:28,554 - decision_tree.py:125 - harmonizations succeeded: 0


2025-02-06 19:09:28,554 - mdp.py:825 - building tree of depth 3
2025-02-06 19:09:51,915 - statistic.py:67 - synthesis initiated, design space: 1e72
> progress 0.0%, elapsed 6 s, estimated 6245475 s (72 days), iters = {MDP: 2}, opt = 0.5919
> progress 0.0%, elapsed 10 s, estimated 10316319 s (119 days), iters = {MDP: 4}, opt = 0.5919
> progress 0.0%, elapsed 13 s, estimated 13902638 s (160 days), iters = {MDP: 6}, opt = 0.5919
> progress 0.0%, elapsed 18 s, estimated 18509030 s (214 days), iters = {MDP: 7}, opt = 0.5919
> progress 0.0%, elapsed 21 s, estimated 21920392 s (253 days), iters = {MDP: 9}, opt = 0.5919
> progress 0.0%, elapsed 25 s, estimated 25396496 s (293 days), iters = {MDP: 11}, opt = 0.5919
> progress 0.0%, elapsed 29 s, estimated 29065400 s (336 days), iters = {MDP: 13}, opt = 0.5919
> progress 0.0%, elapsed 32 s, estimated 1522278515540934 s (48271135 years), iters = {MDP: 20}, opt = 0.5919
> progress 0.0%, elapsed 35 s, estimated 182577520280873 s (5789495 years), iters = {MDP: 31}, opt = 0.5919
> progress 0.0%, elapsed 38 s, estimated 39655616178851 s (1257471 years), iters = {MDP: 40}, opt = 0.5919
> progress 0.0%, elapsed 41 s, estimated 19919573463638 s (631645 years), iters = {MDP: 49}, opt = 0.5919
> progress 0.0%, elapsed 44 s, estimated 16715585683145 s (530047 years), iters = {MDP: 57}, opt = 0.5919
2025-02-06 19:10:34,141 - synthesizer.py:93 - time limit reached, aborting...
--------------------
Synthesis summary:
optimality objective: Pmin=? [F "Crash"] 

method: AR (decision tree), synthesis time: 45.16 s
number of holes: 85, family size: 1e72, quotient: 853166 states / 1147583 actions
explored: 0 %
MDP stats: avg MDP size: 310634, iterations: 58

optimum: 0.591884
--------------------
2025-02-06 19:10:34,142 - decision_tree.py:120 - families considered: 58
2025-02-06 19:10:34,142 - decision_tree.py:121 - families skipped by construction: 0
2025-02-06 19:10:34,142 - decision_tree.py:122 - families with schedulers preserved: 23
2025-02-06 19:10:34,142 - decision_tree.py:123 - families model checked: 35
2025-02-06 19:10:34,142 - decision_tree.py:124 - harmonizations attempted: 10
2025-02-06 19:10:34,142 - decision_tree.py:125 - harmonizations succeeded: 0


2025-02-06 19:10:34,142 - mdp.py:825 - building tree of depth 4
2025-02-06 19:11:36,003 - statistic.py:67 - synthesis initiated, design space: 1e153
> progress 0.0%, elapsed 16 s, estimated 16700871 s (193 days), iters = {MDP: 2}, opt = 0.5919
> progress 0.0%, elapsed 20 s, estimated 20770927 s (240 days), iters = {MDP: 3}, opt = 0.5919
> progress 0.0%, elapsed 25 s, estimated 25039390 s (289 days), iters = {MDP: 4}, opt = 0.5919
> progress 0.0%, elapsed 29 s, estimated 29297938 s (339 days), iters = {MDP: 5}, opt = 0.5919
> progress 0.0%, elapsed 32 s, estimated 32997420 s (1 year), iters = {MDP: 6}, opt = 0.5919
> progress 0.0%, elapsed 36 s, estimated 36564635 s (1 year), iters = {MDP: 7}, opt = 0.5919
> progress 0.0%, elapsed 39 s, estimated 39577863 s (1 year), iters = {MDP: 8}, opt = 0.5919
2025-02-06 19:12:20,720 - synthesizer.py:93 - time limit reached, aborting...
--------------------
Synthesis summary:
optimality objective: Pmin=? [F "Crash"] 

method: AR (decision tree), synthesis time: 50.58 s
number of holes: 181, family size: 1e153, quotient: 853166 states / 1147583 actions
explored: 0 %
MDP stats: avg MDP size: 829842, iterations: 9

optimum: 0.591884
--------------------
2025-02-06 19:12:20,721 - decision_tree.py:120 - families considered: 9
2025-02-06 19:12:20,721 - decision_tree.py:121 - families skipped by construction: 0
2025-02-06 19:12:20,721 - decision_tree.py:122 - families with schedulers preserved: 7
2025-02-06 19:12:20,721 - decision_tree.py:123 - families model checked: 2
2025-02-06 19:12:20,721 - decision_tree.py:124 - harmonizations attempted: 2
2025-02-06 19:12:20,721 - decision_tree.py:125 - harmonizations succeeded: 0


2025-02-06 19:12:20,721 - mdp.py:825 - building tree of depth 5
Traceback (most recent call last):
  File "/home/fpmk/synthesis-playground/paynt.py", line 4, in <module>
    paynt.cli.main()
  File "/home/fpmk/synthesis-playground/paynt/cli.py", line 231, in main
    paynt_run()
  File "/home/fpmk/synthesis-playground/prerequisites/venv/lib/python3.10/site-packages/click/core.py", line 1157, in __call__
    return self.main(*args, **kwargs)
  File "/home/fpmk/synthesis-playground/prerequisites/venv/lib/python3.10/site-packages/click/core.py", line 1078, in main
    rv = self.invoke(ctx)
  File "/home/fpmk/synthesis-playground/prerequisites/venv/lib/python3.10/site-packages/click/core.py", line 1434, in invoke
    return ctx.invoke(self.callback, **ctx.params)
  File "/home/fpmk/synthesis-playground/prerequisites/venv/lib/python3.10/site-packages/click/core.py", line 783, in invoke
    return __callback(*args, **kwargs)
  File "/home/fpmk/synthesis-playground/paynt/cli.py", line 202, in paynt_run
    synthesizer.run(optimum_threshold)
  File "/home/fpmk/synthesis-playground/paynt/synthesizer/decision_tree.py", line 637, in run
    self.synthesize_tree_sequence(opt_result_value, break_if_found=True)
  File "/home/fpmk/synthesis-playground/paynt/synthesizer/decision_tree.py", line 521, in synthesize_tree_sequence
    self.quotient.reset_tree(depth)
  File "/home/fpmk/synthesis-playground/paynt/quotient/mdp.py", line 839, in reset_tree
    self.coloring = payntbind.synthesis.ColoringSmt(
RuntimeError: out of memory
